title,reviews
1461 3홀 모노 블랙 14345001,"오래전에 신던 거라 외면하다 재 구매 했는데.
생각과는 다르네요. 새것 임에도 좀 편해진 느낌도 있고, 예전에 딱딱했던 기억이 많은데. 착화감이 좋아진듯. 코디는 말이 필요 없겠죠."
1461 3홀 모노 블랙 14345001,"발등, 발볼 엄청 작음
가죽이 엄청 뻣뻣함
간지로 견딤"
1461 3홀 모노 블랙 14345001,깔끔하고 65신는데 70으로 업하니까 딱맞습니다
1461 3홀 모노 블랙 14345001,운동화 275신는데 270불편함 없이 신습니다. 처음에 발 한번 넣는데만 고생하고 그뒤론 잘 신겨지네요. 근데 구두들 특징인지 사고나서 새신상태일때 걸을때마다 징징이 걷는 소리가 납니다. 그정도만 생각하고사세용
1461 3홀 모노 블랙 14345001,포스 260 덩크 265 척테 270 신는데 3홀은 260이 맞네요
1461 3홀 모노 블랙 14345001,심플하고 디자인도 기본탬으로 무난하게 좋아요
1461 3홀 모노 블랙 14345001,신발 깔끔하고 예쁘네요. 270~5 정도 사이즈를 신는 편인데 발볼이 넓어 280으로 주문했더니 딱 맞습니다. 신발은 많이 딱딱한 편이네요.
1461 3홀 모노 블랙 14345001,근본탬입니다. 노란 스티치가 있는 버전보다 무난하게 모노로 골랐어요~ 잘 관리하며 신으면서 약간 광이 날때 더 멋져질듯👍
1461 3홀 모노 블랙 14345001,처음에 딱딱한 감이 있었는데 계속 신다보니깐 적응해서 만족하면서 신고 있습니다! 디자인은 최고입니다
1461 3홀 모노 블랙 14345001,선물했는데 너무 좋아하네요. 뿌듯합니다 하하호
1461 3홀 모노 블랙 14345001,"닥마 3홀 근본 그 자체입니다. 노란 스티치, 블랙 스티치 고민 많이 했는데 근본은 노란 스티치죠!"
1461 3홀 모노 블랙 14345001,예뻐요 기본중의 기본인 닥터마틴이에요 살짝 무겁고 뻐뻣해요
1461 3홀 모노 블랙 14345001,"평소 275신는데, 280신으니까 괜찮아요. 270은 넘 작을거같고ㅎㅎ 신발 예쁘고 좋네유"
1461 3홀 모노 블랙 14345001,그냥 캐주얼한 구두 찾으면 요게 가성비인거 같네요 뒤꿈치좀 딱딱하고 키높이는 좀 되는거 같아요
1461 3홀 모노 블랙 14345001,"닥터마틴의 포인트도 잘 살려있고 너무 이뻐요!
초반엔 아프지만.. 가죽 재품이다보니 길들어지면 괜찮을듯하네여"
1461 3홀 모노 블랙 14345001,"노란 스티치가 마음에 들구요
위에서 봤을때의 신발모양이 너무 예쁘네요
착화감은 처음에 조금 딱딱합니다 길들이면 괜찮을거 같네요"
1461 3홀 모노 블랙 14345001,오래 걸어 다녔는데도 편해요 처음 신을때는 뒷꿈치가 좀 아팠는데 신다보니 괜찮아졌어요! 사이즈도 딱 적당합니당
맨즈 허리케인 XLT2 / 1019234-BLK,여름용샌들로 아주아주 마음에 들어요. 착화감도 편안합니다!물에 젖어도 금방 마르고요.
맨즈 허리케인 XLT2 / 1019234-BLK,배송잘받았습ㄴ다 평소에 편하게 신을수 있는 샌들인것 같아요
맨즈 허리케인 XLT2 / 1019234-BLK,선물했는데 좋다고 하네요~! 깔끔한 디자인 좋아요!
맨즈 허리케인 XLT2 / 1019234-BLK,역시 만족하고 쓰는 테바입니다 쫀쫀하고 좋아요
맨즈 허리케인 XLT2 / 1019234-BLK,"장마대비로 구매했는데
평소에도 많이신을거같네요"
맨즈 허리케인 XLT2 / 1019234-BLK,걸어 다닐려고 구매했는데 튼튼하고 좋아요. 시원하고요. 약간 까끌거림
맨즈 허리케인 XLT2 / 1019234-BLK,맨 처음엔 살짝 불편한가 싶었는데 한 이틀 신다보니까 엄청 편하네요 이쁘고 편합니다
맨즈 허리케인 XLT2 / 1019234-BLK,"편하네요 !
후기가 많아서 그냥 믿고 샀어요
여름에 잘 신고 다니려구요"
맨즈 허리케인 XLT2 / 1019234-BLK,편안하고 사이즈도 잘 맞고 좋네요 할인 받아 저렴하게 잘 산거같아요
맨즈 허리케인 XLT2 / 1019234-BLK,표기되는대로 정사이즈입니다. 자로 발 재어보니 270 살짝 넘었는데 270 신으니 딱이네요. 평서에는 275 내외로 신발을 신습니다. 신고 점프해보니 쿠션도 좋고 샌들 중에 탑급이 아닌가 싶습니다
맨즈 허리케인 XLT2 / 1019234-BLK,생각했던 그대로에요 편하고 아주 마음에 드네요
맨즈 허리케인 XLT2 / 1019234-BLK,커플로 신으려고 샀는데 마음에 들어요 ㅎㅎ 편하다고 유명하길래 사봤는데 기대중이에여
맨즈 허리케인 XLT2 / 1019234-BLK,"남자친구 운동화 265신는데 270으로 선물해줬어요
편하다고 맘에 들어합니다"
맨즈 허리케인 XLT2 / 1019234-BLK,정사이즈로 구매하면 딱이네요 샌들은 역시 테바
맨즈 허리케인 XLT2 / 1019234-BLK,남자친구 선물로 사줬는데 편하고 괜찮다고 합니다.
맨즈 허리케인 XLT2 / 1019234-BLK,"딱 캐주얼하게 신기좋은거 원했는데
넘 맘에듭니다"
맨즈 허리케인 XLT2 / 1019234-BLK,여행갈때 쓰려구샀는데 딱 편하구 좋네요 만족합니다
맨즈 허리케인 XLT2 / 1019234-BLK,처음 신어보는 샌들이었는데 가성비 있어서 좋고 많이 신고 다닐 것 같아요~
맨즈 허리케인 XLT2 / 1019234-BLK,엄지발가락 부분이 살짝 쓸리는데 갠찮아요 추천
맨즈 허리케인 XLT2 / 1019234-BLK,"270-280 신고 있어요
처음 신었을때는 조금 큰 것 같은데, 끈 조절하니까 나름 잘 맞는 것 같아요"
맨즈 허리케인 XLT2 / 1019234-BLK,14년도부터 벌써 3개째 구매했습니다. 최고입니다.
맨즈 허리케인 XLT2 / 1019234-BLK,"가죽 재질 샌들을 신어보았는데 딱딱하고 땀 흡수도 잘 안되길래 스트랩 재질 샌들을 눈여겨보다 구매하게 됐습니다.
결과는 대만족이고 자주 애용할듯합니다."
맨즈 허리케인 XLT2 / 1019234-BLK,여름에 데일리로 신을 신발로 강추 장마철이라 맨날 이 신발만 신고 있어요
맨즈 허리케인 XLT2 / 1019234-BLK,바닥이 물렁하지 않아서 지지가 잘 되는 거 같아요
맨즈 허리케인 XLT2 / 1019234-BLK,"무난하게 신기 좋아요 유행?안타는 디자인이고 편해요
조절 끈이 좀 더 길었으면 좋겠네요"
맨즈 허리케인 XLT2 / 1019234-BLK,"역시 테바 입니다
편하고 예쁘고 이번 여름
잘 신고 ㄱㄱ"
맨즈 허리케인 XLT2 / 1019234-BLK,테바 스트랩으로 조절하는 샌들 구매했다가 끈을 조여도 계속 풀려서 너무 스트레스 받아가지고 다른 제품으로 구매했는데 역시 찍찍이 조절이 훨씬 편하네요 ^-^.....
맨즈 허리케인 XLT2 / 1019234-BLK,짱편해요 진짜 요즘 이것만 신고 다님 푹신해서 좋음
맨즈 허리케인 XLT2 / 1019234-BLK,운동화 265신는데 신발큰거 안좋아해서 260으로 주문했는데 다행히 잘맞네요. 근데 어짜피 발목을 잡아주니깐 커도 발이 빠져나오거나 그러진 않을거 같아요.
맨즈 허리케인 XLT2 / 1019234-BLK,"그냥 편함. 발볼 조절되고... 비오는날 굳.

굽도 적당... 러빗..."
맨즈 허리케인 XLT2 / 1019234-BLK,믿고사는 테바입니다 ㅎㅎ 스테디셀러인 이유가 있어요
맨즈 허리케인 XLT2 / 1019234-BLK,운동화280신는데 280사이즈딱이에요! 편안하구좋아요
맨즈 허리케인 XLT2 / 1019234-BLK,튼튼하고 내구성 좋아요 여름에 아주 유용하게 여기저기 코디해서 신기 좋을 것 같아용 테바짱
맨즈 허리케인 XLT2 / 1019234-BLK,선물로 줬는데 착화감도 좋고 오래 신을 수 있을 거 같다고 좋아했어요
맨즈 허리케인 XLT2 / 1019234-BLK,착화감 부드럽고 편해요 사이즈도 딱 맞습니다 슬렉스나 반바지랑 잘 어울릴거같아요
맨즈 허리케인 XLT2 / 1019234-BLK,날씨가 습하고 더워서 요즘같은 날씨에 신고다니기 좋습니다.
맨즈 허리케인 XLT2 / 1019234-BLK,오랜만에 테바를 신었는데 여전히 편안하네요 발볼이 넓은편임에도 딱 맞는거 같아요
맨즈 허리케인 XLT2 / 1019234-BLK,"여자친구랑 커플로 샀는데 편하고 이뻐요
이번여름동안 잘 신을꺼같아요"
맨즈 허리케인 XLT2 / 1019234-BLK,"정말 싸구려 슬리퍼가 닳고 닳아서 빗길에
자꾸 미끄러짐이 심해서 장마기간이기도 하고
난생처음 샌들 시켰는데 정말 마음에 듭니다
잘 신을게요"
맨즈 허리케인 XLT2 / 1019234-BLK,"신랑 발볼이 있는편인데 편하다고 하네요~
맘에들어요~"
맨즈 허리케인 XLT2 / 1019234-BLK,유명해서 이번에 처음 사봤는데 착화감도 생각보다 좋가고 이뻐요
맨즈 허리케인 XLT2 / 1019234-BLK,"컨버스 270신는데 사리즈10 다운해서 신으니 적당하네요. 발볼러에게 좋을 것 같아요.
저한테 너무 뚱뚱하네요 그래도 착용감은 최고입니다!"
맨즈 허리케인 XLT2 / 1019234-BLK,신발은 이쁜데 처음이라 그런지 걷기가 약간 불편하네요
맨즈 허리케인 XLT2 / 1019234-BLK,상품평과 판매량이 증명합니다! 매우 편하고 착화감 좋습니다. 정사이즈 추천.
맨즈 허리케인 XLT2 / 1019234-BLK,친구추천으로 샀는데 생각보다 푹신하고 편하고 사이즈조절 넘좋음
맨즈 허리케인 XLT2 / 1019234-BLK,편하게 막신으려고 구매했습니다. 마감이나 재질은 가격수준입니다.
맨즈 허리케인 XLT2 / 1019234-BLK,스테디셀러인 이유가 있네툐 쿠션감도 좋고 사이즈도 작당합니다.
맨즈 허리케인 XLT2 / 1019234-BLK,비 올 때 편안하게 싣고 다닐 수 있어서 완전 좋아요~~
맨즈 허리케인 XLT2 / 1019234-BLK,여름 해변용으로 구입했는데 발도편하고 마음에 들어요
맨즈 허리케인 XLT2 / 1019234-BLK,좋네요. 이번여름은 이걸로 보내야 겠어요. 오래신어도 편합니다
맨즈 허리케인 XLT2 / 1019234-BLK,뒤꿈치 부분이 살짝 낮은 느낌은 있는데 편하게 잘 신고 있습니다.
맨즈 허리케인 XLT2 / 1019234-BLK,예전에 편하게 잘 신던게 생각나서 이번 여름에 신으려고 다시 주문했는데 편하게 잘신고 다니는 중입니다~
맨즈 허리케인 XLT2 / 1019234-BLK,메인 사진이 뭔가 밑창이 얇게 보여서 고민이 됐는데 전혀 아닙니다 생각보다 훨씬 두툼해서 푹신푹신해요
맨즈 허리케인 XLT2 / 1019234-BLK,비올때 신었는데 착용감이 좋아요 발도 편안하고 넘 좋네요
맨즈 허리케인 XLT2 / 1019234-BLK,디자인 예쁘고 색도 깔끔합니다 아무 옷에나 매치가능
맨즈 허리케인 XLT2 / 1019234-BLK,255-260 신어서 250 시켰어요 남자친구 선물로오~ 커플로 신을거에요 사진만 보고 남자친구가 곤충채집 하는거 같다고 하더니 신어보니 생각보다 이쁘다고 맘에 들어하네요 기분 좋은 밤🧚🏻‍♀️ 사이즈도 잘맞아요
맨즈 허리케인 XLT2 / 1019234-BLK,찍찍이가 세군데 있어서 사이즈 웬만하면 잘 맞아요 반사이즈 낮춰서 샀어요
맨즈 허리케인 XLT2 / 1019234-BLK,예전부터 갖고싶었던 샌들인데 너무 만족스럽네요~ 올여름 이쁘게 신고 다닐거 같아요 ㅎㅎ
맨즈 허리케인 XLT2 / 1019234-BLK,여남 상관없이 누구나 잘 신을 수 있을 것 같아여 추천
맨즈 허리케인 XLT2 / 1019234-BLK,스트랩 배치가 아주 이뻐요 착화감도 좋아서 뛰는데 무리없네요
맨즈 허리케인 XLT2 / 1019234-BLK,밑창이 부드러워서 편해요 발볼도 조절하기 쉽고
맨즈 허리케인 XLT2 / 1019234-BLK,간만에 좋은제품 구매한거 같아 기분이 좋습니다 굳굳
맨즈 허리케인 XLT2 / 1019234-BLK,발볼이 저한테 좀 작아서 아쉽지만 나머지는 만족합니다.
맨즈 허리케인 XLT2 / 1019234-BLK,"신발 사이즈도 잘 맞고 색감도 잘 나왔네요.
뒷꿈치가 쿠션이라 물을 흡수해서 비오는날 신을수있을지는 모르겠어요."
맨즈 허리케인 XLT2 / 1019234-BLK,일단 넘 편하구요 자라 세일한다고 샀다가 환불하고 이거 다시 샀습니다... 발볼 넓은 편인데 잘 맞습니다. 심플하게 아무데나 좋은 것 같아요.
맨즈 허리케인 XLT2 / 1019234-BLK,사이즈는 정사이즈로 가니 딱맞아 좋았어요 무더운 여름에 잘 사용하네요 ^^
맨즈 허리케인 XLT2 / 1019234-BLK,우선 편해서 전투용으로 신기 좋아요. 디자인도 무난하고 착화감도 너무 푹신하지 않고 적당합니다.
맨즈 허리케인 XLT2 / 1019234-BLK,"남편 사줬는데 좋아하네여ㅎㅎ
박스 열자마자 이쁘다!! 하고 신어보는데 신고 걸어보니까 편하데영~~"
맨즈 허리케인 XLT2 / 1019234-BLK,가볍고 편해요 디자인도 예뻐서 어디에나 매칭하기 좋습니다
맨즈 허리케인 XLT2 / 1019234-BLK,여름에 신으려고 샌들 찾다가 구매햇는데 만족합니다 평소 260-65 신는데 260 완전 잘 맞아요! 튼튼해서 오래 신을 수 있을거같아요
맨즈 허리케인 XLT2 / 1019234-BLK,쿠션이 보기보다 푹신해서 편하게 신을 수 있어요. 다만 끈이 교차되는 지점은 약간의 통증이 있네요
맨즈 허리케인 XLT2 / 1019234-BLK,"270을 평균으로 신고 좀 작게 나온건 275신어요
볼 등 있고요, 길이가 생각보다는 조금 긴 편 인데 다운 하기엔 무리가 있을거라 생각되어 저와 같은 사이즈를 신으시는 분들은 정사이즈 신는게 맞을듯 합니다."
맨즈 허리케인 XLT2 / 1019234-BLK,편하고 신고 바다 들어갔는데 금방마르고 좋아요
맨즈 허리케인 XLT2 / 1019234-BLK,스트랩으로 사이즈 조절을 할 수 있어서 좋습니다.
맨즈 허리케인 XLT2 / 1019234-BLK,"걸을 때 쿠션감이 좋아서 발이 편해요! 다만 앞의 스트랩을 조절 잘 해야 할 것 같아요. 처음 신을 때는 발등부분의 앞스트랩 때문에 많이 걸으면 자국도 남고 아팠는데, 조절을 하니깐 한결 편안해졌어요!
사이즈는 반업하는 것 보단 반다운해서 스트랩으로 조절하는 것이 좋을 것같아요(일반발 기준)"
맨즈 허리케인 XLT2 / 1019234-BLK,여름에 편하게 막 신기 좋으면서 스타일도 낼 수 있는 최고의 샌들이지 않나 싶네요 ㅎㅎ
맨즈 허리케인 XLT2 / 1019234-BLK,무난하게 괜찮은 상품이네요 사이즈도 품질도 좋아요
맨즈 허리케인 XLT2 / 1019234-BLK,275인데 발볼 넓어서 280 시켰는데 아직 걸어다녀보진 않았지만 신으니까 사이즈는 맞는 것 같아요
맨즈 허리케인 XLT2 / 1019234-BLK,세일해서 착한게 산거같고요 발 볼이 넓은신분들은 크게 신어주세요
맨즈 허리케인 XLT2 / 1019234-BLK,남자친구 사줬는데 275신어서 280 사줬더니 크더라구요.. 발이 조금 두껍고 볼이 있는편이라 크게 주문했는데 그냥 270 주문할껄 그랬어요ㅠㅠ 그래도 신으니까 편해서 좋다 그러고 작은 것보다는 큰게 낫다고 좋아하더라구요 ㅎㅎ 커플로 샀는데 잘 신고있어요!!
맨즈 허리케인 XLT2 / 1019234-BLK,"굿 좋아요 갠찬네요 굿 할인된가격에 잘삿어요 ㅎㅎ
국굿"
맨즈 허리케인 XLT2 / 1019234-BLK,나이키 265신는데 260으로하니 딱맞네요. 발볼있으신분들은 정사이즈 추천합니다
맨즈 허리케인 XLT2 / 1019234-BLK,"착화감도 좋고 배송도 빨리되서 매우만족합니다
할인된가격에 구매해서 매우만족합니다"
맨즈 허리케인 XLT2 / 1019234-BLK,쿠션감도 좋고 뒷꿈치 패드도 편합니다. 사이즈가 조금 커요
맨즈 허리케인 XLT2 / 1019234-BLK,"할인된 가격으로 가성비 좋네요
추천할만 합니다"
맨즈 허리케인 XLT2 / 1019234-BLK,편하고 이뻐서 요즘 매일 신고다닐정도입니다요
맨즈 허리케인 XLT2 / 1019234-BLK,"샌들쓰..
여름에 긴바지 반바지 모두잘어울릴거같아요
이쁩니다"
맨즈 허리케인 XLT2 / 1019234-BLK,"가볍게 캐쥬얼하게 신으려고 샀어요.
마음에 듭니다."
맨즈 허리케인 XLT2 / 1019234-BLK,편안하게 신고 다니기 좋은 샌들을 찾아서 좋슴니다
맨즈 허리케인 XLT2 / 1019234-BLK,튼튼할거같아 나쁘지않습니다 20자 채우기 힝
맨즈 허리케인 XLT2 / 1019234-BLK,"세일해서 착한 가격에 잘 샀어요

만족합니다

담 세일에 하나 더 사려구요

다른색으로"
맨즈 허리케인 XLT2 / 1019234-BLK,아직 사용 전이라 잘 모르겠지만 배송이 엄청 빨라서 놀랐고 후기가 좋은만큼 여름에 잘 활용하리라 생각해요
맨즈 허리케인 XLT2 / 1019234-BLK,"사이즈도 적당하고 이쁘네요
발볼러한테도 괜찮은거 같습니다"
맨즈 허리케인 XLT2 / 1019234-BLK,발도 편하고 디자인도 무난해서 입문하기 좋습니다
맨즈 허리케인 XLT2 / 1019234-BLK,여름용 시원하고 좋아요 편하고 예쁘네요 이번여해에 신으려고 구매
맨즈 허리케인 XLT2 / 1019234-BLK,정사이즈 주문했는데 앞뒤가 긴 편입니다. 스트랩으로 쪼이면 딱 맞아요. 이쁘고 편합니다
맨즈 허리케인 XLT2 / 1019234-BLK,사려고 했던게 세일하니까 너무 좋네요 맘에 들어요
맨즈 허리케인 XLT2 / 1019234-BLK,남자친구 사줫는데 좋아해요 265사이즈인데 270 잘맞네요
맨즈 허리케인 XLT2 / 1019234-BLK,화요일날 신으려구 급하게 토요일날 주문했는데.. 월요일 오전에 도착하는 이 배송속도 무엇.. 사랑하고 감사합니다 ㅜ 게다가 신발도 넘 예쁘고 볼 넓은편이라 반사이즈업했더니 아주 낙낙~~하게 신어요 최고ㅠ 업 안해도 찍찍이가 개많아서 조절 가능할거같음... 많이파세요
맨즈 허리케인 XLT2 / 1019234-BLK,배송 빠르고 잘 받았어요 생각보다 사이즈가 커보이네요
맨즈 허리케인 XLT2 / 1019234-BLK,"무난하게 올해여름 보낼 수 있을것 같아요
280 신던데로 갔는데 잘맞네요"
맨즈 허리케인 XLT2 / 1019234-BLK,하루종일 신고 다녀도 발이 하나도 안피곤해요.올여름에 많이 신을것 같네요.
맨즈 허리케인 XLT2 / 1019234-BLK,바닥도 안 미끄러질 것 같고 좋네요 벨크로로 사이즈 조절도 되고
맨즈 허리케인 XLT2 / 1019234-BLK,예전에 사신고 맘에 들어서 재구매 했습니다 너무 좋아요
맨즈 허리케인 XLT2 / 1019234-BLK,"와우 진짜 편함 여름 필수템이에요
디자인도 그냥그냥 같지만 볼수록 이쁘네요 ㅋㅋ"
맨즈 허리케인 XLT2 / 1019234-BLK,"빠른 배송 잘 받았습니다.
벨크로 부분이 많아서 발에 딱 맞게 신을 수 있어서
좋습니다. 평소 운동화 260 신는데, 같은 사이즈로
가니 편하게 잘 맞습니다."
맨즈 허리케인 XLT2 / 1019234-BLK,사자마자 할인때린건 화나지만 만족하고 신을랍니다
맨즈 허리케인 XLT2 / 1019234-BLK,"테바 오랜만에 신어보는데 편하고 푹신하네요
잘신겠습니다"
맨즈 허리케인 XLT2 / 1019234-BLK,잘 받았습니다~ 사이즈도 딱 정당한 것 같고 편해요
맨즈 허리케인 XLT2 / 1019234-BLK,사이즈도 딱이고 샌들인데도 편해요. 여름에 물놀이나 평상시에도 아주 잘 신을 거 같네요.
맨즈 허리케인 XLT2 / 1019234-BLK,"샌들 큰맘먹고 구입했습니다

정말 편하네요

잘 신겠습니다."
맨즈 허리케인 XLT2 / 1019234-BLK,요름에 닥 신기 좋은 샌들이에요 검은 색은 어디든 무난한 진리죠
맨즈 허리케인 XLT2 / 1019234-BLK,"발에 이상한 거품이 자꾸 끼는거 말고는 만족하는데
향균처리로 인해 거품이 생긴다는거 같은데 정말 불편함 그 외에 착화감이나 디자인적으로는 깔수없음"
맨즈 허리케인 XLT2 / 1019234-BLK,발볼이 좁은 편인데 사이즈가 잘 맞습니다 여름내내 편하게 신어질것 같아요!
맨즈 허리케인 XLT2 / 1019234-BLK,여름에 신기에 아주 무난하고 편안한 샌들입니자 추천합니다
맨즈 허리케인 XLT2 / 1019234-BLK,"본인 신발사이즈랑 같거나 265면 260신으면 될듯해요
편함니다"
맨즈 허리케인 XLT2 / 1019234-BLK,"무난하게 신기 좋고, 사이즈도 정사이즈로 딱 맞네요."
맨즈 허리케인 XLT2 / 1019234-BLK,솔직히 발이 너무 편하고 피로하지 않아요! 올여름은 테바만 신을꺼 같아요
맨즈 허리케인 XLT2 / 1019234-BLK,뒤쪽 발목 잡는부분 밴드형태로 늘어나던거 없어져서 아쉽네요.
맨즈 허리케인 XLT2 / 1019234-BLK,"생각보다 편하고 디자인도 깔끔합니다
약간 후리한 느낌이에요"
맨즈 허리케인 XLT2 / 1019234-BLK,샌들 긴가민가하면서 샀는데 정말 만족해요 바닥이 요즘은 참 편하게 나오네요
맨즈 허리케인 XLT2 / 1019234-BLK,"품질 좋고 오래 쓸게요~
아주 만족합니다~ㅎㅎ 좋아좋아"
맨즈 허리케인 XLT2 / 1019234-BLK,"평소 255-260 신고, 좀 크다해서 250샀는데 너무 딱맞는듯한 느낌? 260샀어도 됐을듯해요"
맨즈 허리케인 XLT2 / 1019234-BLK,테바 편하네요 신발이 이쁘기도 하고 좋습니다잇
맨즈 허리케인 XLT2 / 1019234-BLK,스포티한 디자인인데도 색이 너무 예뻐서 편안한데 예쁘게 신을 수 있어서 매우 만족합니다. 선물해줬더니 아주 좋아해요!
맨즈 허리케인 XLT2 / 1019234-BLK,"심플해서 여기저기 편하게 신기 좋은 것 같아요
장마철 대비해서 남편 하나 사줬습니다!!"
맨즈 허리케인 XLT2 / 1019234-BLK,"배송온 날 신구 한강 다녀왔는데 착화감 엄청 편해요!
게다가 발볼 부분 사이즈 조잘할 수 있어서 발볼 넓은분도 반사이즈 업한 다음에 찍찍이 늘려서 신으시기 좋을 것 같아요!🫶🏻"
맨즈 허리케인 XLT2 / 1019234-BLK,아직 처음이라 좀 딱딱하고 너무 딱 맞는데 예쁘니까 일단 어디 한 번 두고 보겠음
맨즈 허리케인 XLT2 / 1019234-BLK,"신었던 테바 신발중에 제일 편합니다.
밑창 두께도 있어서 어느정도 키높이도 되구요."
맨즈 허리케인 XLT2 / 1019234-BLK,샌들 뒤에 마감 부분이 적당히 푹신하고 발바닥 부분도 푹신해서 좋아요~
맨즈 허리케인 XLT2 / 1019234-BLK,배송도 빠르고사이즈고민했는데 정사이즈 맞네요
맨즈 허리케인 XLT2 / 1019234-BLK,"기존에 신던 샌들이 오래신으면 발에 피로감이 있어 찾던 중 구매했습니다
서재페 다녀왔는데 편하게 잘 댕겨 왔네요 발 편해요"
맨즈 허리케인 XLT2 / 1019234-BLK,"너무 편안하고 자주신을것 같아요~ 완전최고!
발도 너무 잘잡아줘요~"
맨즈 허리케인 XLT2 / 1019234-BLK,테바샌들은 무적이다 착화감 미쳤다 알파바운스의 너무 심한 푹신함과 버켄스탁의 딱딱함의 딱 중간정도의 완벽한 쿠셔닝이다 반사이즈 다운하면 딱맞다
맨즈 허리케인 XLT2 / 1019234-BLK,"여름에 신으려고 구매했는데
사이즈도 잘 맞고 가볍네요"
맨즈 허리케인 XLT2 / 1019234-BLK,가장 기본적인 스타일로 편안한 하의에 잘 어울려요. 편하게 잘 신을 것 같아요.
맨즈 허리케인 XLT2 / 1019234-BLK,잘산거같슴니다 가볍고 예쁘고 편합니다 세탁도용이할거같아요
맨즈 허리케인 XLT2 / 1019234-BLK,아빠가 만족해하세요 항상 테바는 성공적이네요
맨즈 허리케인 XLT2 / 1019234-BLK,발볼 넓어서 나이키 런닝화 260 신는데 이 샌들은 길이는 좀 넉넉히 긴데 발볼이 좁게 나온 편이라서 발이 작아보이고 싶은 분들은 사이즈 다운할만하지만 발볼이 넓은 분들은 정사이즈로 가는게 좋을 거 같아요
맨즈 허리케인 XLT2 / 1019234-BLK,"보통 265를 신는데 260 주문했더니 잘 맞아요
발가락 앞에 너무 여유 있는 것보다 나아요"
맨즈 허리케인 XLT2 / 1019234-BLK,"좋아요ㅎㅎ 역시 편하고
여름에 편하게 신기 좋은 제품입니다"
맨즈 허리케인 XLT2 / 1019234-BLK,발볼이 너무 좁아서 신발이 옥죄는 느낌... 역시 신발은 신어보고 사야겠네요
맨즈 허리케인 XLT2 / 1019234-BLK,"밑창 탄탄하고 좋아요
볼이랑 발등 조절할수있어서 편해요"
맨즈 허리케인 XLT2 / 1019234-BLK,편하고 튼튼함을 느낌. 여름에 이것만 신고 다닐것 같음.
맨즈 허리케인 XLT2 / 1019234-BLK,신발 깔끔하고 이쁘네요 좋습니다 색감도 이쁘고
맨즈 허리케인 XLT2 / 1019234-BLK,발볼이 넓은데 늘릴수도잇고 정사이즈사면 발에맞게 사이즈조절 할수잇어서 너무좋아요
맨즈 허리케인 XLT2 / 1019234-BLK,어버이날로 아빠한테 선물해드렸는데 맘에 들어하세요 착화감도 좋고 디자인도 무난해서 좋아요
맨즈 허리케인 XLT2 / 1019234-BLK,여름에 편하게 신고다닐게 필요했는데 딱인거같아요
맨즈 허리케인 XLT2 / 1019234-BLK,270치고는 약간 작게 나온 느낌이에요 디자인 귀여워요
맨즈 허리케인 XLT2 / 1019234-BLK,아무거나 받혀입기 너무 좋네요 잘 샀어용!! 여름에 맛깔나게 신을꺼 같아요
맨즈 허리케인 XLT2 / 1019234-BLK,완전좋아 월요일 좋은것보다 좋아 화요일보자 이걸 사야대
맨즈 허리케인 XLT2 / 1019234-BLK,발볼이 조금 작은데 그것 말고는 전반적으로 가격대비 우수합니다~
맨즈 허리케인 XLT2 / 1019234-BLK,"신랑 사줬는데 좋아하네요~
평소 265-270 신는데 후기보고 270으로 구매 했습니다. 260으로 샀으면 발길이가 딱 맞아 불편했을거 같아요~"
