title,reviews
1461 3홀 모노 블랙 14345001,"복숭아뼈 닿을때마다 움찔거리긴 하는데
이뻐서 참고 신을만해요"
1461 3홀 모노 블랙 14345001,역시 믿고사는 닥터마틴 너무 예뻐용 우리형이 좋아해서 뺏어갔어요
1461 3홀 모노 블랙 14345001,"발 아플까봐 걱정했는데 저는 잘맞는지 편해요
그래도 처음엔 뒷꿈치에 밴드 붙였어요"
1461 3홀 모노 블랙 14345001,닥터마틴 찐 매니아 입니다 넘 예뻐요 벌써 3개째 신어요
1461 3홀 모노 블랙 14345001,"적당한 크기로 나왔습니다.
발볼이 크거나 하지는 않아서 따구맞느 것 같구요."
1461 3홀 모노 블랙 14345001,"나이키 운동화 240신어서 240샀는데 잘맞아요 ㅋ
벼르고 벼르다 산건데 마음에 듭니다 ㅋ 익숙해질때까지는 발이 아플것같아서 무섭긴하지만 이쁘니까 잘 길들여보려구요"
1461 3홀 모노 블랙 14345001,너무 맘에 듭니다! 길들여야할것같지만 너무 이뻐요!
1461 3홀 모노 블랙 14345001,"애용하던 신발이였는데 이제 보내줄 때가 돼서 새로 샀는데 정가가 올라서 아쉽,, 좀 일년 신어야 광 올라옴"
1461 3홀 모노 블랙 14345001,신고나서 보면 진짜 이뻐요 더비슈즈에 대해서 잘몰랐는데 데일리로 무난해요
1461 3홀 모노 블랙 14345001,사이즈 반업했는데 적당해요~ 무난하고 마음에 듭니다~
1461 3홀 모노 블랙 14345001,발볼 발등 넓고 높은 분들은 사이즈업이나 스무스모델 추천
1461 3홀 모노 블랙 14345001,좋아요 생각보다 그리 불편하지도 않고 포멀하게 입을때 도움 많이되는 느낌입니다
1461 3홀 모노 블랙 14345001,딱딱하지만 예뻐요. 잘 신고 다니겠습니다. 짱짱굿
1461 3홀 모노 블랙 14345001,오랫만에 닥터마틴 구입했는데 기본디자인이라 말할 것도 없이 마음에 듭니다. 나파가죽이 부드러워서 편하게 신기에 좋네요.
1461 3홀 모노 블랙 14345001,신기에도 편하고 자주 신을거 같아요 너무 이쁘네요!
1461 3홀 모노 블랙 14345001,내구성 최고라니까 오래신어봐야알거같아요 처음엔 발아플듯
1461 3홀 모노 블랙 14345001,보통 신발을 270~280 을 신는 편인데 280 주문했다가 좀 커서 고통받고있습니다^^; 저같은 분들은 270 신으시는걸 추천합니다
1461 3홀 모노 블랙 14345001,역시 닥터마틴이에요 신발이 너무 이쁘고 좋아요!
1461 3홀 모노 블랙 14345001,닥터마틴 3홀 오래 신을 수 있을 것 같아요 너무 예쁨
1461 3홀 모노 블랙 14345001,정말 귀엽습니다 깔끔하고 기본 디자인에 기본 색상이라 두루두루 잘 어울립니다
1461 3홀 모노 블랙 14345001,5사이즈가 없는게 아쉽네요 한사이즈 크게 샀는데 좀 많이 크네요
1461 3홀 모노 블랙 14345001,착화감 생각보다 괜찮고 첫 더비슈즈인데 이쁘네요
1461 3홀 모노 블랙 14345001,친구 대신 사줬는데 너무 만족하네요 입문용으로 적합한 것 같아요
1461 3홀 모노 블랙 14345001,아주 만족해요! 닥터마틴에서 가장 클래식하면서 패션어블한 코디가 가능해요!
1461 3홀 모노 블랙 14345001,배송도 잘 왔고 신발 너무 이쁘네요 감사합니다!! 잘 신겠습니다!!
1461 3홀 모노 블랙 14345001,"너무 예뻐요 닥터마틴 처음 사는데 몇몇 분들은 빽구두, 아저씨같다 그러고 몇 분들은 완전 예쁘다 그랬어요 제 눈에는 완전 사랑스러워요"
1461 3홀 모노 블랙 14345001,이쁘고 학교 갈때나 친구들 만날때 자주 손이가네요
1461 3홀 모노 블랙 14345001,역시나 실물 너무 예쁘고 재질도 완전 좋아서 최고입니다!!
1461 3홀 모노 블랙 14345001,너무 이쁘게 좋습니다 또 좋은 디자인있면 구매가각가기각
1461 3홀 모노 블랙 14345001,물집 잡히는 것을 예상하고 샀습니다. 어느 바지에나 잘 어울릴 것 같아요.
1461 3홀 모노 블랙 14345001,역시 닥터마틴 아즌 맘에 들고 색깔도 엄청 이뻐요
1461 3홀 모노 블랙 14345001,착화감은 좋은편은 역시 아닌거 같은데 이뻐요 신다보면 더 편해지겠죠 ㅎ
1461 3홀 모노 블랙 14345001,"270-275신어요
발볼 보통에 오른쪽발등만 높아요
270딱좋네야"
1461 3홀 모노 블랙 14345001,"평소 270 신는데 270 꽉 껴요 발볼러라 그런가

왜 5단위로 안나오는건가 닥마는

신발도 개 딱딱하면서"
1461 3홀 모노 블랙 14345001,"하자 없이 잘 왔어요. 컨버스 245 편하게 잘 신는편인데, 240으로 사니까 딱 좋네요. 모노/스무스/나파 고민중이었는데, 스무스 유광이 좀 부담스럽고 모노는 좀 더 날렵+발등 낮은 느낌이라 캐쥬얼한 느낌인 나파로 샀어요."
1461 3홀 모노 블랙 14345001,닥터마틴 신발은 항상 사보면 이뻐서 마음에 듭니다.
1461 3홀 모노 블랙 14345001,무아인 쿠폰으로 싸게 데려갑니다.. 이넘때문에 제 지갑이 배고파하네요
1461 3홀 모노 블랙 14345001,유튜브보고 구매했는데 상당히 만족스럽습니다
1461 3홀 모노 블랙 14345001,"면접에서 잘 신었고, 평상시에도 많이 신게 됩니다ㅎㅎ"
1461 3홀 모노 블랙 14345001,아빠 선물로 사줬는데 너무 좋아하네요 신는데 불편함 없고 편하다고 합니다. 추천합니다.
1461 3홀 모노 블랙 14345001,발볼이 조금 넓은 편인데 이 신발은 이상하게 악명과는 다르게 저와 잘 맞네요 ㅎㅎ 뉴발 270 신는데 딱히 불편한 점은 없습ㄴ다
1461 3홀 모노 블랙 14345001,너무 이쁘고 가성비가 좋아요 역시 무신사 자주 이용할께요.
1461 3홀 모노 블랙 14345001,닥터마틴 처음사보는데 딱딱해서 발아프긴하지만 두번째신을땐 훨씬편해요
1461 3홀 모노 블랙 14345001,가죽이여서 그런지 모르겠지만 딱딱해서 발이 약간 아픕니다
1461 3홀 모노 블랙 14345001,닥터마틴을 딱 상징하는 기본적인 모델이지 않나 싶네요. 뒷꿈치는 조금 아프니 보호대 사서 붙이고 신으시는거 추천합니다.
1461 3홀 모노 블랙 14345001,딱딱하고 무겁긴 한데 닥터마틴이니까^^ 예쁘게 잘 신을 것 같아요
1461 3홀 모노 블랙 14345001,예뻐요. 가끔 가다 한 번 씩 신어요. 계속 사고 싶었었는데 기회 보다 저렴하게 샀습니다.
1461 3홀 모노 블랙 14345001,"디자인 예뻐요
기존에 신던거 보다 밑창이
딱딱한 편이에요"
1461 3홀 모노 블랙 14345001,"매장가서 시착해보고 샀어요 원래 240 신는데, 이건 240은 좀 헐떡이고 230이 완전 딱맞아서 고민했슴다 그치만 딱맞으면 나중에 아플거같아서 그냥 원래 신던 240으로 샀어요"
1461 3홀 모노 블랙 14345001,역시나 처음은 딱딱하네요 조금 여유있게 구매하는 게 좋을듯!
1461 3홀 모노 블랙 14345001,닥터마틴 더비슈즈가 필요해서 샀는데 매장에서 몇번 신어보긴 했지만 사이즈가 딱 맞네요. 원래 280부터 290까지 왔다 갔다 해서 회사마다 사이즈가 다 달라 헷갈리는데 잘 산것 같아요. 옐로우 스티치 있는 모델이 발등도 높고 발볼이 좀 넓었던것 같아서 샀어요.
1461 3홀 모노 블랙 14345001,"사이즈 애매하다 싶으면 무조건 크게 가야됩니다.

운동화 275 신으면 무조건 280 가야됩니다 신발 작아요"
1461 3홀 모노 블랙 14345001,색상 너무 이쁨. 발도 생각보다 불편하지 않음. 코디하기 너무 편함:)
1461 3홀 모노 블랙 14345001,"한 사이즈 업해서 신으시는걸 추천합니다!
많이 딱딱해요"
1461 3홀 모노 블랙 14345001,"명불허전 더비입니다
아직 신지는않았습니다 잘신겠습니다"
1461 3홀 모노 블랙 14345001,닥마의 악명을 이번에도 이겨낸다 기본템으로 굿
1461 3홀 모노 블랙 14345001,믿고사는 닥터마틴! 엄청 편한 느낌은 아니지만 로퍼치고 편안한 편입니다. 강추!
1461 3홀 모노 블랙 14345001,선물용으로 사서 줬는데 오래 길들여야 될 것같이요 마치 군화 신교대에서 받은느낌
1461 3홀 모노 블랙 14345001,깔끔하고 이쁩니다~착화감은 딱딱한편이라 적응이 필요하겠고 사이즈는 정사이즈 편하고 좋네용
1461 3홀 모노 블랙 14345001,배송이 빠르고 동생 생일선물로 사줬는데 너무 좋아하네요~~
1461 3홀 모노 블랙 14345001,신발 너무 귀엽고 딱 초콜릿 색상에 오래 신어도 예쁠 구두입니다
1461 3홀 모노 블랙 14345001,사이즈 생각보다 널널하네요 ㅎ 보통 정사이즈 워커나 로퍼들보단 널널합니다. 처음 뒷축 살짝 까지는데 금방 익숙해지네용 이뻐여-!!
1461 3홀 모노 블랙 14345001,미니멀한 감성 내기에 너무 좋은 더비슈즈인거 같아요 ㅎㅎ
1461 3홀 모노 블랙 14345001,디자인은 너무 예쁜데 엄청 딱딱해서 길들이는 동안은 고생 좀 할 것 같아요
1461 3홀 모노 블랙 14345001,처음사보는 구두인데 생각보다 무겁지만 불편하거나 그러진않고 예뻐요 착화감도 괜찮고
1461 3홀 모노 블랙 14345001,너무 예쁘지만… 좀 오래 걷고 발꿈치를 잃을뻔 했어요
1461 3홀 모노 블랙 14345001,생각보다 발이 안 불편해서 좋았어요 금방 길들여져요!
1461 3홀 모노 블랙 14345001,닥마 신발을 살 줄은 몰랐는데 행사맞이 처음 사봤어요
1461 3홀 모노 블랙 14345001,신발 핏은 정말 예쁜데 뒤꿈치를 내어줘야 합니다..뒤꿈치 아직도 한 번 신으면 엄청 까져요ㅠㅠ
1461 3홀 모노 블랙 14345001,"사이즈는 큰 편이며,
소재는 스크래치에 약한 가죽 소재입니다.
빈티지한 무드로 대부분 잘 어울립니다."
1461 3홀 모노 블랙 14345001,더비 슈즈의 정석입니다. 광택이 과하지 않고 쉐입도 매끈하게 잘 빠졌습니다. 처음엔 빡빡하지만 금새 질이 집합니다. 슬랙스는 물론 캐주얼한 옷에도 무난하게 어울립니다.
1461 3홀 모노 블랙 14345001,평소 275 신는데 280 주문하니까 딱 맞네요 참고하세요
1461 3홀 모노 블랙 14345001,"확실히 딱딱한 느낌이긴 해요! 사이즈 265, 270 신으시는 분들은 270이 맞는 건 같아요!!"
1461 3홀 모노 블랙 14345001,"너무 예쁩니다
235 칼발 인간에게는 약간 크긴 했어요"
1461 3홀 모노 블랙 14345001,"처음이라 좀 딱딱하지만
신다보면 적응될것같아요
모던하니 좋습니다"
1461 3홀 모노 블랙 14345001,진짜 딱딱해서 길드리는데 고생좀 할거 같아요. 그래도 이뻐서 맘에 듭니다.
1461 3홀 모노 블랙 14345001,만족감이 높아요 믿고사는닥마.. 잘샀다는생각밖에안드네요! 추천합니다
1461 3홀 모노 블랙 14345001,전부터 너무사고싶었는데 너무 만족합니다 감사해요
1461 3홀 모노 블랙 14345001,"닥마 3홀 모양은 너무 이쁩니다. 다만 길들이기까가 많이 힘들거 같긴하네요.
하지만 그만한 가치가 있습니다."
1461 3홀 모노 블랙 14345001,디자인은 괜찮은데 신발이 많이 무겁고 딱딱하네요..나쁘진 않아요
1461 3홀 모노 블랙 14345001,"기존에 260, 265 신는데 반업해서 신으니깐 편해요!
색깔도 마음에 들고 좋습니다"
1461 3홀 모노 블랙 14345001,신을 구두가 없어서 찾아봤더니 이게 근본 구두라고 하더라구요 제가 신기에도 부담스럽지 않을것 같아 샀는데 많이 안신어서 잘모르겠지만 착화감 좋진 않습니다
1461 3홀 모노 블랙 14345001,It’s very nice and satisfaction you use this
1461 3홀 모노 블랙 14345001,역시 마틴은 진리입니다 다만 초반에 뒷꿈치는 ㅠㅠ네요 ㅋ
1461 3홀 모노 블랙 14345001,"처음엔 발뒷꿈치가 너무 아프고 그랫는데 신다보니까 괜찮아져요 이뻐서 신습니다
뒷꿈치 밴드가 필수"
1461 3홀 모노 블랙 14345001,가성비가 좋고 데일리 룩으로 입으면 좋아요. 강추함
1461 3홀 모노 블랙 14345001,친구가 너무 좋아했어요 믿고 사는 닥마입니다 크
1461 3홀 모노 블랙 14345001,짱짱 뭘입어도 잘어울림 한 일주일은 피의신발인데 일주일지나니깐 편해요 주름지는것도 멋스럽고
1461 3홀 모노 블랙 14345001,색상이 너무 맘에 듭니다 고급지다는 느낌이 드는 신발입니다
1461 3홀 모노 블랙 14345001,쪼금 크게 신으니까 발이 안아파서 좋아요 이쁘고 오래신을것같아서 좋아욘
1461 3홀 모노 블랙 14345001,아주 좋고 역시 워커는 닥터마틴이 최고에요 처음엔 온발이 아파요
1461 3홀 모노 블랙 14345001,기본적으로 하나 가지고 잇으면 어디에나 잘 어울려서 잘 신을거 같아여
1461 3홀 모노 블랙 14345001,"상태가 매우 안 좋았지만, 뭐 검수 어찌고가 귀찮아서 걍 신었어요. 사이즈는 240->230이 딱 좋은데 신발끈이 너무 자주 풀려요ㅜㅜ 발이 엄청 아프진 않지만 자주 손이 가지는 않는,, 근데 예쁜 .."
1461 3홀 모노 블랙 14345001,사이즈 나이키 뉴발 255 정사이즈인데 250가니까 딱 맞네요. 이쁘긴한데 가죽이 너무 딱딱해서 신기 전부터 겁나네요. ㅎㅎ
1461 3홀 모노 블랙 14345001,남자친구 사줬는데 좋아해서 다행이예요 추천추천
1461 3홀 모노 블랙 14345001,처음 신으면 발 많이 아프다길래 걱정했는데 생각보다 불편하지도 않고 이뻐요!
1461 3홀 모노 블랙 14345001,역시 스테디에는 이유가 있는 것 같습니다. 정말 단단하고 오래 신을 것 같네요.
1461 3홀 모노 블랙 14345001,사이즈가 생각보다 커서 놀랐습니다 하지만 꽉끈을하니까 신을만 하네요 나중에 또 사면 한사이즈 줄여서 살거같습니다
1461 3홀 모노 블랙 14345001,첫 더비로 닥터마틴에서 구매했는데 적당히 신을만해요
1461 3홀 모노 블랙 14345001,구두 처음 사보는건데 생각보다 괜찮아서 무난하게 입을때 좋을거 같아용
1461 3홀 모노 블랙 14345001,"확실히 딱딱해서 좀 길들여야 할 것 같습니다.
이쁜 건 진짜 이쁘네요"
1461 3홀 모노 블랙 14345001,스무스 좋아해서 구매했는데 스무스 보다는 살짝 앞이 뾰족하네요
1461 3홀 모노 블랙 14345001,정사이즈인데 생각보다 가죽이라 그런지 발이 많이 아팠습니다 그래도 신발은 신다보면 늘어나기에 신어보려고 합니다
1461 3홀 모노 블랙 14345001,"가죽이 너무 딱딱해서 뒷축과 옆면 쓸림이 심함
발 볼이 넓어서 한 치수씩 큰 상품을 사는데
275는 너무 크고 270은 볼이 많이 작은 애매한 크기
다른 분들 사신다면 275사시는게 편할듯"
1461 3홀 모노 블랙 14345001,"좋네요 또 구매 해야 겧습니다.
좋은상품 감사드려요"
1461 3홀 모노 블랙 14345001,좋아요 이건 인정입니다 굿이에요 굿 굿 오지게 이쁨
1461 3홀 모노 블랙 14345001,처음으로 닥터마틴 제품 구매했는데 무난하게 신고 다니기 좋은거같아요
1461 3홀 모노 블랙 14345001,닥터마틴 신으니 이뻐요~ 착화감도 괜찮은 것 같아요
1461 3홀 모노 블랙 14345001,"남녀노소 누구나 신발장에 하나 구비해야하는 기본템.

제 평소 신발 사이즈
에어포스1 : 270
아디다스 스탠스미스 : 265

이외 웬만하면 265~270인데 이건 10단위로 밖에 안나오고 확실히 크게 나왔네요 260 딱 좋습니다"
1461 3홀 모노 블랙 14345001,"역시 닥마는 발이 편하지 않지만
클레직한 매력이 있는거 같습니다"
1461 3홀 모노 블랙 14345001,"너무 이뻐요 벌써 세켤레째 신고있습니다
담에 또 이용할게요"
1461 3홀 모노 블랙 14345001,보통 245신는데 240은 너무 딱맞아서 반업해서 250샀어요. 살짝 크킨튼데 와이드한 바지랑 입으니깐 예뻐요! 반바지엔 못입을듯ㅠㅠ 왕발처럼 보임..
1461 3홀 모노 블랙 14345001,친구 선물로 줬는데 너무 맘에 들어해요 디자인도 깔끔하고 괜찮은 거 같아요~
1461 3홀 모노 블랙 14345001,좀 작은 감은 있네요. 계속 신다보면 편해 진다니깐 계속 신어 봐야겠어요
1461 3홀 모노 블랙 14345001,발목부분을 칼로 만든거 제외하고는 최상의 기본템
1461 3홀 모노 블랙 14345001,어떤 코디에나 다 잘 어울리고 코디하기 쉬워요!! 너무 마음에 듭니당
1461 3홀 모노 블랙 14345001,신으면 발이 편하진 않지만 디자인은 맘에 듭니다
1461 3홀 모노 블랙 14345001,정말 이쁘지만 처음에 발 아프고 적응하려면 조금 걸립니다
1461 3홀 모노 블랙 14345001,이쁘고 다 좋은데 확실히 발목부근이 딱딱하네요 길들이긴 해야할듯
1461 3홀 모노 블랙 14345001,역시 닥터마틴 다 까지긴 했는데 그래도 길들이기 전까지는 악깡버..
1461 3홀 모노 블랙 14345001,"유명한데는 이유가 있네요 너무 예쁩니다
265신는ㄷ 270신으니까 딱 좋아요"
1461 3홀 모노 블랙 14345001,기본템으로 항상 가지고 있는 제품입니다 선물했는데 만족해하네요
1461 3홀 모노 블랙 14345001,"좀 무겁고 불편한데 깔끔해서 좋습니다
빨리 길들기를"
1461 3홀 모노 블랙 14345001,예쁘네요 잘신겠습니다 많이 파시고 행복하세요
1461 3홀 모노 블랙 14345001,"발뒤꿈치 불편하다는 얘기 듣구 망설옇는데
잘 산거 같습니다
불편한거 없구요
270 샀는데 일반 사이즈보다 조금 넉넉한거 같습니다"
1461 3홀 모노 블랙 14345001,이뻐요 좀 무겁지만 신고다니면 편해요 고급집니다
1461 3홀 모노 블랙 14345001,너무 이뻐요 생각보다 착용감도 좋아서 좋았습니다
1461 3홀 모노 블랙 14345001,발이 엄청 편하지는 않은데 신을만 합니다 예뻐요
1461 3홀 모노 블랙 14345001,분위기 있게 신어도 돼고 가볍게 신어도 좋은 신발이에요!!
1461 3홀 모노 블랙 14345001,"예쁜거 둘째치고 일단 뒷꿈치
개박살납니다 ..ㅋㅋ 도저희 못신겠어여 10분안으로 살껍데기 일어나요"
1461 3홀 모노 블랙 14345001,한치수 크게 주문하세요 배송도 느렸고 교환 절차가 불만족스러웠내요
1461 3홀 모노 블랙 14345001,예쁘긴한데 확실히 딱딱하긴해요 ㅠㅠ 발에 물집나는건 감안하셔야할듯
1461 3홀 모노 블랙 14345001,살까말까 고민 오래했었는데 진작에 살걸그랬어요 너무 예뻐요
1461 3홀 모노 블랙 14345001,평소에 닥터마틴 자주 신는데 역시 닥터마틴이다. 착화감이 딱딱하나 길들이면 괜찮다.
1461 3홀 모노 블랙 14345001,"스니커즈 생각하고 크게 샀다가 사이즈 변경했네요 정사이즈로 가시면 될 것 같아요
발볼도 넉넉한데 처음에는 뒷굼치가 진짜 갈려나갑니다 길들이면 괜찮고 신발은 진짜 엄청 이뻐요"
1461 3홀 모노 블랙 14345001,"아주 깔끔 합니다.
물론 발은 아픕니다만.. 잘 늘려가야죠!"
1461 3홀 모노 블랙 14345001,더비 처음이라 제일 유명한 닥터마틴 샀는데 역시 이쁘네요
1461 3홀 모노 블랙 14345001,믿고조는 기본템입니다 하나쯤은 장만해두는게 좋습니다
1461 3홀 모노 블랙 14345001,너무너무 이뻐요 앞으로 믿고사요!! 정말 추천드려요!
1461 3홀 모노 블랙 14345001,꽉낍니다. 숨막혀요. 그래도 신발은 작게 신어야하니 집에서 신고있으면서 열심히 늘려야겠어요. 디자인은 역시 굿굿
1461 3홀 모노 블랙 14345001,예쁘긴한데 들은대로 딱딱하네욕 길들이기까지 시간좀 걸릴듯 합니다 ㅜ
1461 3홀 모노 블랙 14345001,"쿠션감있어서 너무 편하고, 굽도 어느정도 있어서 좋아요"
1461 3홀 모노 블랙 14345001,"착화감이 딱딱하긴 한데 그건 닥터마틴 특유 느낌이라 괜찮았어요! 오늘 첫 개시하고 한 4시간 정도 돌아다녔는데 꽤나 금방 제 발에 맞춰질 것 같긴 합니다! 다만 상품이 구형이 온 거 같아요. 전에 매장 갔을때 숄이 운동화 끈처럼 되있길래 물어봤더니 제가 받은 구두끈 형태는 구형 제품이라고 하더라구요,, 그래도 이쁩니다!"
1461 3홀 모노 블랙 14345001,신으면 발 아플꺼라고 많이 들었는데 생각보다 편했습니다. 노란색 스티치가 너무 튀거나 어려보이지 않을까 했는데 실제로 신어보니 무난무난하게 포인트가 되네요~
1461 3홀 모노 블랙 14345001,평소 270신어서 270 그대로 갔다가 너무 커서 사이즈 다운해서 신으니 그나마 맞네요!
1461 3홀 모노 블랙 14345001,운동화 255신는데 끈안풀고 주걱없이 쉽게들어가요 내마감이 잘되있어서 발이 빠지거나 하진않아요
1461 3홀 모노 블랙 14345001,"운동화랑 같은 정사이즈로 구매하니 딱 맞네요
할인받아서 나름 싸게 잘구매했어요"
1461 3홀 모노 블랙 14345001,처음 신 닥터마틴 인데 입문으로 좋은거 같네요 귿
1461 3홀 모노 블랙 14345001,가장 무난한 닥터마틴으로 처음엔 조금 발이 아프지만 이쁜디자인으로 충분히 감안할만 합니다.
1461 3홀 모노 블랙 14345001,첫 닥마인데 소재가 딱딱하긴해요ㅠㅠ 그치만 예쁜건 말해모해입니다! 나파는 220이 맞는데 반해 크홀은 230 신어도 피보네요ㅠ 참고하시면 좋을거같아요~
1461 3홀 모노 블랙 14345001,"확실히 신발은 무거운데 사람발마다 착화감은
차이가 클거같아요"
1461 3홀 모노 블랙 14345001,"역시 이쁘고 좋아요!
길들이기 단계만 잘 넘기면 무난"
1461 3홀 모노 블랙 14345001,"고급스러운 느낌이 정말 마음에 드네요
추천합니다"
1461 3홀 모노 블랙 14345001,유명한 만큼 진짜 좋은 신발입니다. 많이 신을수록 더 예뻐지는 거 같아요
1461 3홀 모노 블랙 14345001,뭐 그냥 기본 아주 좋아요 ㅋ 구두 대신 신어요 닥마최고
1461 3홀 모노 블랙 14345001,"닥터마틴 불편하단 얘기는 많이 들었는데 신발이 예뻐서 홀려서 사버렸어요 그렇게 저는 예쁜 고문기계를 샀습니다 누가 닥마는 길들여서 신는 거랬는데 제가 신발을 길들이는 게 아니라 제 발이 고통에 길들여지는 듯...

1. 사이즈 얘기
정사이즈로 샀는데 손가락 하나 들어갈 정도로 남고 걸을 때마다 엄지발가락 끊어질 것 같이 눌려서 따로 닥마 깔창을 사서 넣었더니 딱 맞아요 딱 맞으니까 이번엔 뒤꿈치 쓸려서 물집이 잡히네요 엄지발가락은 여전히 끊어질 것 같아요 근데 신발이 이뻐서 계속 신게 됨 고통스러운데 자꾸 신고 싶어요 멈출 수가 없어 너무 예뻐요 근데 아픔 근데 예쁨 근데

2. 빈티지함
빈티지브라운이란 이름답게 신발끈 좀 묶었다 풀었다 했더니 스크래치가 수두룩해지고 몇번 걸었더니 구두 접힌 자국이 우수수해져서 개시한지 5분만에 몇개월 신은 신발처럼 빈티지해졌어요 근데 이쁨

3. 사바사
닥마 편하단 분들도 계시니 아마 사바사인가봐요 제 발은 닥마에 맞지 않는듯 닥마에 어울리는 발이 되도록 열심히 길들여야겠어요

신발은 진짜 예뻐요 짱"
1461 3홀 모노 블랙 14345001,신다보면 제 발에 맞게 되갖고 편해짖니다 역시 닥마
1461 3홀 모노 블랙 14345001,닥터마틴이라 처음 착화감은 감안하고 샀어요. 신발은 깔끔하고 굽은 투박해서 아무 스타일이나 다 잘어울려요. 생각보다 숨겨진 굽이 높아요!
1461 3홀 모노 블랙 14345001,245가 없어서 240으로 샀는데 너무 꽉껴요ㅜㅜ 자꾸 신어서 늘려야 할 거 같아요
1461 3홀 모노 블랙 14345001,처음 신으면 딱딱하긴 한데 신다 보면 적응됩니다. 추천합니다.
1461 3홀 모노 블랙 14345001,"닥마 한달쭉 사용하면 처음엔 엄청딱딱하다가
점점 내발처럼 바뀜 ㄹㅇ"
1461 3홀 모노 블랙 14345001,동생 생일선물로 사줬는데 동생이 마음에는 매우 들어했으나 신고 나가면 으악을 꾸준히 외칩니다
1461 3홀 모노 블랙 14345001,"매번 250 사이즈를 신어서 250으로 구매하였습니다.

이전 신었던 닥터마틴 보다 뭔가 더 딱 맞는 느낌이지만 신다보면 늘어나서 괜찮을거 같습니다.

딱딱해서 길들이기 좀 오래 걸릴거 같지만 잘신겠습니다"
1461 3홀 모노 블랙 14345001,너무좋은데 발볼이 좀좁아요나머지는 예쁘네요
1461 3홀 모노 블랙 14345001,옷 색상 사이즈 핏 너비 전부 몸에 맞고요 이쁘네요
1461 3홀 모노 블랙 14345001,정말 예쁩니다 이미 유명한 신발이라 믿고 사시면 될거같네요
1461 3홀 모노 블랙 14345001,"더비는 밀란더비 엘클라시코더비
다음으로 닥터마틴"
1461 3홀 모노 블랙 14345001,닥마 3홀이야 뭐 이쁘고 하지만 무광이라 더 이쁜거같슴다
1461 3홀 모노 블랙 14345001,길들이는데 시간좀 걸리겠지만 이만한 더비 찾기 어렵죠
1461 3홀 모노 블랙 14345001,무광이라 매우 예쁜 것 같아요 그냥 정사이즈 가도 댈듯
1461 3홀 모노 블랙 14345001,"무난하고 특별하게 튀지않으면서 적당히 브랜드있고 기본으로 딱 맞는거 같습니다
닥터마틴 특유인지 생각외로 하드한 느낌이 들어요"
