title,reviews
마일즈 블랙 슬리퍼 23523001,"무겁긴한데 편하고 좋아요!
여름 신을만 하네요 굿"
마일즈 블랙 슬리퍼 23523001,발볼이랑 발등높티에 맞춰서 구매하는가 추천드려뇨
마일즈 블랙 슬리퍼 23523001,정 사이즈 대비 약간 작은 편이긴 해도 가죽 끈 스트랩 조정해서 편하게 신을 수 있어요. 굽이 높고 무게감이 있어서 사이즈업 했다가는 너무 투박해 보일 수 있으니 정사이즈로 사시는 걸 추천 합니다.
마일즈 블랙 슬리퍼 23523001,닥터마틴.. 솔직히 무겁고 딱딱한데 아픔을 참을 수 있을만큼의 이쁨이라 계속 신고 있습니다..
마일즈 블랙 슬리퍼 23523001,원래 250 신는데 250 신으니깐 딱 맞아요 너무 이쁜데 물집이 잡히긴 했어요ㅠㅠ
마일즈 블랙 슬리퍼 23523001,"여자친구 선물로 정사이즈 딱이네요
뽀대납ㄴ다요"
마일즈 블랙 슬리퍼 23523001,"워낙 유명한 템이라,,,
하루 이틀 딱딱한 거에 적응이 필요하지만
이후로는 편하고 예뻐요
아무데나 툭 신어주면 잘 녹아드는 거 같아요"
마일즈 블랙 슬리퍼 23523001,발등이좀아프긴하지만 감안해도 예뻐서 자주 신을것같아요
마일즈 블랙 슬리퍼 23523001,"고딩 딸냄걸루 구입했어요
운동화 240사이즈 신어서
정사이즈 주문했는데
딸냄 발볼이 좁은편은 아닌데
한칸 안으로 줄이니 적당하네요
제가 발볼이 있어서 250사이즈 신는데
잘 맞아요
신발은 일단 묵직한 감은 있구요
딱딱해서 걸을때 신발이 자연스레 꺾이지 않으니
첨 이런 신발을 신어선지 딸냄은 넘어질것 같다네요
일단 신발이 이뻐서 맘에 들어하네요"
마일즈 블랙 슬리퍼 23523001,230으로 할걸그랬어요 약간 크네요! 무게운게 단점이지만 그래두 이뻐여ㅠㅠ
마일즈 블랙 슬리퍼 23523001,적당히 예쁘면서 그냥 아주 맘에 들어요 그래서 자주 신고다닙니다
마일즈 블랙 슬리퍼 23523001,굽이 5cm 이상으로 엄청 높아서 만족스러워요.
마일즈 블랙 슬리퍼 23523001,너무이뻐요 확실히 고급스럽고 다른제품들하고 퀄리티가 다르내요
마일즈 블랙 슬리퍼 23523001,키높이도 되구 좋아요!! 근데 제 발은 물집잡히고 쓸렸습니다ㅠ
마일즈 블랙 슬리퍼 23523001,뭐 까지거나 그런거 없이 편하긴 한데 무겁기두해서 익숙해져야할거같아요 ㅎㅎ
마일즈 블랙 슬리퍼 23523001,처음 신을땐 불편한데 몇번 신어서 길들이니 완전 편해요 굽도 높아서 긴 바지 입고 신으면 좋아요
마일즈 블랙 슬리퍼 23523001,평소 신발 270 신어요. 270 정사이즈 가니까 잘맞네요. 끈 살짝 느슨하게 하니까 편합니다.
마일즈 블랙 슬리퍼 23523001,신발 자체가 길어서 조금 큰 느낌은 있지만 편하고 좋네요~
마일즈 블랙 슬리퍼 23523001,편안하게 여름에 신기 좋은거같아요 노란색 포인트 주기도 좋아요
마일즈 블랙 슬리퍼 23523001,청키한 느낌 좋아하시는 분들 완전 추천합니다 교복템이에요 굿굿
마일즈 블랙 슬리퍼 23523001,처음엔 딱딱하지만 길들이면 괜찮아요. 그리고 모든걸 감수 하고 신을정도로 예쁘고 느낌있어요!
마일즈 블랙 슬리퍼 23523001,평소 230~235신는데(나이키는 240) 230샀더니 딱맞고 좋아용
마일즈 블랙 슬리퍼 23523001,"조금 딱딱해서 발 아픈거 말곤 괜찮습니다.
질만 들이면 잘 신고다닐 수 있겠네요~~"
마일즈 블랙 슬리퍼 23523001,선물용으로 샀는데 굽이 높아서 키높이로 좋을것같네요
마일즈 블랙 슬리퍼 23523001,"사진보다 실물이 마음에 들어요
235-240 신는데 240 구매했습니다 잘 맞아요"
마일즈 블랙 슬리퍼 23523001,"색감도 너무 이쁘고
포장도 깔끔하고 튼튼히 오고
무엇보다 무난하게 코디하기 너무 좋아요!"
마일즈 블랙 슬리퍼 23523001,정사이즈로 사면 딱 맞는거 같고 밑창이 엄청 딱딱하지 않아서 좋아요
마일즈 블랙 슬리퍼 23523001,일단 너무 예쁘고 발바닥 딱딱할 줄 알았는데 괜찮은 듯
마일즈 블랙 슬리퍼 23523001,발바닥이 약간 쓸리는? 까지는 부분이 있긴 한데 신을 수록 덜합니다. 굽 높은 거도 좋고 다 잘 어울립니다!
마일즈 블랙 슬리퍼 23523001,"사이즈 참고용 후기
나이키 255 아디다스 250 컨버스 255꽉끈
250구매했더니 얇은 양말 신고도 널널해서 버클 가장 안쪽으로 조임. 길이는 딱 맞음"
마일즈 블랙 슬리퍼 23523001,아직 밖에서 신어보진 못했지만 오래걷게되면 발까질꺼같긴한데..이뻐서 발까지는거쯤..머..
마일즈 블랙 슬리퍼 23523001,발은 아프지만 예뻐서 참을 수 있네요 키도 커지고 짱좋
마일즈 블랙 슬리퍼 23523001,"첫 닥터마틴 제품을 마일즈로 선택
이유는 다른 제품들보다 발이 덜 아플것 같아서.
정사이즈로 가면 얼추 맞을것 같고,
여름철 코디활용에 아주 좋다."
마일즈 블랙 슬리퍼 23523001,사고싶었던 슬리펴였는데 사보니 역시 이쁘고 편안하네요
마일즈 블랙 슬리퍼 23523001,슬리퍼는 좀 크게 사야될 것 같아서 한 사이즈 업해서 샀는데 발볼 좁으시고 발등 높이? 별로 안 높으면 정사이즈 추천이요~
마일즈 블랙 슬리퍼 23523001,"닥터 마틴 아니랄까봐 무지 무겁습니다.
대신 착화감은 좋아요! 우레탄 밟는 느낌입니다."
마일즈 블랙 슬리퍼 23523001,발이 좀 까지기는했지만 편하게 잘신고있습니다
마일즈 블랙 슬리퍼 23523001,진심 이쁨 편하게 신기좋고 너무너무너무너무 이쁨
마일즈 블랙 슬리퍼 23523001,닥처마틴 치고 되게 안아프고 편안해서 놀랐음. 추천함
마일즈 블랙 슬리퍼 23523001,평소245신어요 240구매했는데 너무 딱 맞는거 같아서 250으로 교환했더니 50은 좀 크네요ㅠ걸을때 좀 헐떡거리는.. 245여자분들은 240으로 구매하시는걸 추천드려요. 후기보니까 생각보다 가볍고 편하다고 얘기 많이 하시는데 저한테는 무게감이 느껴지고 오래걷기힘듦 발까짐은 없으나 바닥이 좀 불편하네요 그럼에도 불구하고 신발은 너무 예뻐서 만족해요 조금무겁고 편하지않은걸 미리알았어도 구매했을거 같아요
마일즈 블랙 슬리퍼 23523001,스타일이 정말좋고 편하지만 높이가 너무 높습니다
마일즈 블랙 슬리퍼 23523001,사이즈250인데 딱 맞아요 ㅎㅎ정사이즈 하시면 될 것 같아요
마일즈 블랙 슬리퍼 23523001,여자친구랑 커플로 신으려고 샀는데 너무좋아해요
마일즈 블랙 슬리퍼 23523001,발볼 발등은 조절 가능하시니까 신발 밑창 넓이만 생각하시고 구매하시면 좋을것 같습니다! 디자인은 넘예
마일즈 블랙 슬리퍼 23523001,좋습니다여자친구선물로사줫는데ㅁ에들어하네오
마일즈 블랙 슬리퍼 23523001,처음에 발등에 물집 잡혔는데 계속 신다보니 발에 맞게 편해져요 매일 이것만 신는중 완전 만족
마일즈 블랙 슬리퍼 23523001,딱 루즈핏처럼 떨어지고 좋습니당 편하게 입으세용
마일즈 블랙 슬리퍼 23523001,나이키 에어포스 240 신는데 발볼이 넓은 편이어서 250으로 시켰어요! 살짝 널널하게 잘 맞고 불편하다는 리뷰가 있어서 걱정했는데 엄청 오래걷지 않는 이상 괜찮은 듯 해요!
마일즈 블랙 슬리퍼 23523001,"발사이즈 245인데 사이즈 고민 엄청 하다가 240샀는데 딱 좋아요!! 250샀으면 엄청 컸을거같아요,, 바닥도푹신푹신 넘 좋습니당"
마일즈 블랙 슬리퍼 23523001,"이틀ㅉㅐ 길들이기 중인데 모래주머니 차고 걷는 기분이지만 예뻐서 참음,,
진짜 예뻐서 n년전부터 살말 고민할때 그냥 살걸 후회중"
마일즈 블랙 슬리퍼 23523001,발볼 넓은 250인데 딱 맞아요~ 사이즈 확인하느라 신었을땐 푹신하니 착용감 괜찮았어요~
마일즈 블랙 슬리퍼 23523001,"닥터마틴 스럽레 이쁘고 좋습니다.
다만 약간 무거운느낑밍..."
마일즈 블랙 슬리퍼 23523001,너무 편하고 좋아서 남자친구꺼 추가 구매했어요!!
마일즈 블랙 슬리퍼 23523001,역시 닥터마틴입니다. 이쁘고 실용감 좋네요! 불편하진 않았어요 잘 신고 다닐듯
마일즈 블랙 슬리퍼 23523001,친구 선물로 구매했는데 예상한 것처럼 딱 맞고 친구도 맘에 들어해서 만족스러워요! 지역 택배사 파업으로 인해 문의사항이 있었는데 친절하게 설명해주시고 바로 빠른 처리 도와주셔서 감사하고 정말 좋았습니다.
마일즈 블랙 슬리퍼 23523001,어우 많이 걸으면 약간 발등 쪽이 까지긴 하지만 와이드한 팬츠입고 여름에 조금만 돌아다니거나 차를 자주 이용해서 예쁘게 신고 다니고 있습니다
마일즈 블랙 슬리퍼 23523001,"저는 생각보다 덜 아파서 신을 만 했어요
예쁘니 다들 장만하세요 ~"
마일즈 블랙 슬리퍼 23523001,여자친구가 선물 받고 너무 좋아라 합니다~~:) 감사합니다!
마일즈 블랙 슬리퍼 23523001,"살짝 무겁지만 좋네요.
꾸안꾸에 적합하고 진짜 데일리로 많이 신을 거 같아요.
배송도 빨랐어요"
마일즈 블랙 슬리퍼 23523001,예뻐요 고민하다가 샀는데 신었을때 넘예뻐서 잘산것같아요 다만 무거워요.
마일즈 블랙 슬리퍼 23523001,"신발 적응하는데, 한 3주 정도 걸린 것 같아요
굳은살이 생기니까 괜찮네요
신발은 예뻐요~~"
마일즈 블랙 슬리퍼 23523001,운동화250신어서 그냥 슬리퍼도 250샀는데 발사이즈는 맞는데 볼이 쫌 넓어서 줄여서 신으면 딱이예요!
마일즈 블랙 슬리퍼 23523001,"닥터마틴 샌들 제품별로 다있는데, 가장 가볍구요 닥마맞나
싶을정도로 푹신해서 놀랬어요. 오히려 어색하네요..근데 바닥부분은 원래 재질이 더좋은것 같아욥. 습기를
다 흡수하는 재질이라서 우려됩니다. 그래도 키높이 효과 넘 좋아요~"
마일즈 블랙 슬리퍼 23523001,"빠른 배송! 친절한 답변! 상품 하자 없이 잘 왔어요!
예쁘게 신을게요:)"
마일즈 블랙 슬리퍼 23523001,여자친구선물해줬는데 처음엔 조금 발아프다하더니 몇번신고나서는 익숙해졌는지 편해젔다네요 디자인도 너무좋대여
마일즈 블랙 슬리퍼 23523001,닥터마틴 무거운 거는 알았지만 알아도 엄청 무겁네요ㅋㅋ 그래도 어느 정도 지나면 익숙해질 듯 신발 너무 예뻐요
마일즈 블랙 슬리퍼 23523001,굽도 적당히 높고 어디에 활용해도 예쁜 것 같아요 ㅎㅎ
마일즈 블랙 슬리퍼 23523001,"보통 235 신는 발인데 길이랑 발볼도 잘 맞네요!
굽이 있어서 키높이 효과 좋아요 ㅎㅎ
꾸안꾸템으로 신기 좋네요!"
마일즈 블랙 슬리퍼 23523001,"너무 이뻐요!!
이쁘고 생각보다 편해서 잘 신을거 같아요
여름 내내 잘 신겠습니당"
마일즈 블랙 슬리퍼 23523001,"이쁩니당 키높이도 있어서 좋아요
처음 신고 돌아댕긴 날 발등은 다 까졌습니다"
마일즈 블랙 슬리퍼 23523001,"발볼이 넓은편인데도 넉넉하게 잘 맞습니다! 버클로 되어있어서 발볼 안맞으면 조절할 수 있어서 좋아유
신발이 조금 무겁긴한데 걸어다니는데 큰 지장은 없습니다!"
마일즈 블랙 슬리퍼 23523001,예쁘도 발도 나름 편해서 좋아요 버클로 조절가능해서 굿
마일즈 블랙 슬리퍼 23523001,"착화감은 안좋은건 워낙 유명하니 그러려니 하고 신었는데 생각보다 나쁘진 않네요 ㅋㅋ 255 신는데
조금 커요ㅠ 그것 말고는 딱히 불만은 없네용가뤼"
마일즈 블랙 슬리퍼 23523001,조금 무겁긴한데 디자인이 예뻐요 ! 발볼도 넓어요!
마일즈 블랙 슬리퍼 23523001,완전 총알배송이에요!!! 진짜 배송빨리왔고 신발은 진짜 너무이뻐용 ㅋ 사이즈는 원래 발볼넓어서 235 신는데 230 시켰더니 딱 잘맞아요~!! 약간 무겁긴하지만 아무대나 잘어울려서 스탈리쉬해보이고 완전 만족하는신발이에요!!!!짱짱
마일즈 블랙 슬리퍼 23523001,"이쁜데 발이 아프네요ㅠㅜ
쿠셔닝은 있는데 가죽이 닿는 발등 부분이 아파요"
마일즈 블랙 슬리퍼 23523001,평소65 신는데 70은 남긴 하지만 60보단 업시키는게 나은것같아요
마일즈 블랙 슬리퍼 23523001,음 275 운동화 신어요 ! 반업해서 280하니까 적당하네요! 물론 처음 신을땐 아파요!
마일즈 블랙 슬리퍼 23523001,"5단위 신으시는 분들은 반업하는게 좋을듯 합니다
작게갔다가 교환했어요 ㅜㅜ"
마일즈 블랙 슬리퍼 23523001,사이즈 275인데 280 주문하니 널널하게 좋아요.
마일즈 블랙 슬리퍼 23523001,"너무너무 훌륭한 제품 잘 받았급니다
닥터마틴 역시 이름값하메요"
마일즈 블랙 슬리퍼 23523001,이뻐요 데일리로 잘입고 신고 다니겠습니다아앙
마일즈 블랙 슬리퍼 23523001,너무 예쁜데 무거워요^^ 발목 조심조심 예뻐서 다 용서가능
마일즈 블랙 슬리퍼 23523001,생각보다 굽이 높긴한데 전체적으로 이뻐서 좋아요
마일즈 블랙 슬리퍼 23523001,느낌이 좋아요 신고 다니기도 편해서 자주 신게 되네요 살짝 무겁긴 해요
마일즈 블랙 슬리퍼 23523001,"굽이 높아서 그런지 자주는 못신겟고
가끔 신어요 그래도 예쁘긴합니다"
마일즈 블랙 슬리퍼 23523001,스티치 색이 포인트 되서 궈엽고 어디에나 매치하기 쉬워요
마일즈 블랙 슬리퍼 23523001,"필자는 220부터 230까지 다양한 사이즈의 신발을 신는 기괴한 발을 가진 이로 대애충 225를 신는다는 말씀이옵니다.
더운 여름날 검은 운동화 안이 마치 마그마로 족욕을 하는 기분에 참을 수가 없어 결국 맨발의 편안함을 충족시켜줄 슬리퍼를 서칭했고 후줄근한 차림에도 언밸런스하지 않고 자연스레 녹아드는 마틴 의사선생님의 것을 채택하였사옵다.
그리고 고민 끝에 230이라는 아주 낭낭한 길이를 초이스했사옵니다.
서론은 이쯤하고 결론부터 말하자면 소자에게는 몹시 큽니다.
분명 검색을 했을 때에는 내 사이즈의 사람들에게 다 딱맞아보였는데 말이지요…
아무튼 발등쪽을 쪼이면 헐렁하진 않으니 어여쁘게 신어보려합니다.(절대로 교환 귀찮아서가 아님)"
마일즈 블랙 슬리퍼 23523001,색감도 좋고 편하게 신고다니기 좋은 슬리퍼고 코디하기도 좋습니다.
마일즈 블랙 슬리퍼 23523001,"네모네모 발이라 사이즈 엄청나게 고민하고 찾아봤는데 어떤 분이 실측 사이즈 올려주신 거 보고 도움 많이 받아서 저도 한번 써봅니다

저는 발길이는 22.5인데 발등도 높고 발볼 단면은 9.5인 발볼 부자고요 평소에 운동화 구두 가리지 않고 235를 신습니다 닥터마틴은 1490, 패트리샤 둘 다 230 신는데 좀 커서 헐떡거리지만 편하게 잘 신고 다녀요

마일즈 230 기준 맨발로 신으면 뒤가 0.5정도 남고 양말 신고 신으면 약간 여유있어보이는 정사이즈로 맞아요

230 실측 사이즈는 발 닿는 면 기준 발길이 약 24, 제일 넓은 곳 기준 발볼 8.5 정도 되는 것 같습니다

삼일정도 눈알 빠지게 사이즈 찾아보다가 결정 했는데 너무 잘 맞아서 신나서 써봤어요 다들 사이즈 선택 성공하시길 바랄게요"
마일즈 블랙 슬리퍼 23523001,여름에 꾸안꾸로 신을 슬리퍼가 마땅하지 않았는데 왜 지금 샀을까 싶을정도로 너무 이쁩니다
마일즈 블랙 슬리퍼 23523001,좋아요 근데 역시 가죽인지라 좀 길들여야 할 필요가 있습니다
마일즈 블랙 슬리퍼 23523001,모든 신발을 240으로 신어서 마일즈도 240으로 시켰습니다. 길이는 엄지손톱만큼 남아요. 약간 큰가 했는데 발볼을 조여주니 딱 좋네요.
마일즈 블랙 슬리퍼 23523001,완전 편하고 딱 좋아요 🖤 잘 신을게요! 그리고 예뻐요!
마일즈 블랙 슬리퍼 23523001,"생각보단 기존의 닥터마틴 신발에 비해 편하고 덜 아퍼요
다만 밑창이 잘 까져서 그게 아쉬워요"
마일즈 블랙 슬리퍼 23523001,반스 225 신는데 딱 맞아요 240했으면 클뻔했어요
마일즈 블랙 슬리퍼 23523001,"실물 예쁘고 굽때문에 키 커보이고
디자인은 진짜 마음에 드는데 너무 무거워요..
그래서 너무 불편해요… 돌덩이를 신고 다니는거 같아요
그래도 예뻐요 ㅎ"
마일즈 블랙 슬리퍼 23523001,"사진보다 실물이 훨씬 더 예뻐요!
신으면 발이 편한데 제가 발 피부가 약해서 그런지 발등(끈 있는 쪽)에 물집이 하나 잡혔어요ㅠㅠ 적응하면 괜찮을 것 같아요.
그래도 너무 예쁘고 편하니까 너무 만족합니다!"
마일즈 블랙 슬리퍼 23523001,후기들 보고 발등 아프다고 해서 걱정했는데 저는 하나도 안 아팠어요!! 반스 230신는데 잘 맞습니다
마일즈 블랙 슬리퍼 23523001,짖짜 너무 예뻐요 올여름 최고의 소비 발도 별로 안아파여 밑창 망가질까바 완전 조심히 신고 잇슴
마일즈 블랙 슬리퍼 23523001,사고싶은거라 고민고민하더 구입했는데 너무 맘에듭니다 진작살껄 하네요...잘 신겠습니다
마일즈 블랙 슬리퍼 23523001,"너무 너무 예뻐요
처음에 신었을때 생각보다 많이 높아서 당황했지만 신다보니 적응해서 지금은 너무 잘신고 있습니다 감사합니다"
마일즈 블랙 슬리퍼 23523001,여자친구 사줬는데 무거운거빼면 만족한다고합니다
마일즈 블랙 슬리퍼 23523001,가격대에 비해서 만족도는 그냥그럼. 후기를 바로 올린건 아니지만 11만원 이상주고 산 슬리퍼 뒤가 이미 조금 뜯어짐ㅜㅜ
마일즈 블랙 슬리퍼 23523001,"평소에 닥마 220 신는데, 7켤레 이상 있는 닥마중 가장 딱 맞아요!!! 슬리퍼라 딱맞으니까 더예뻐요
편하고 정말 자주 신게되여 ㅎ ㅎ"
마일즈 블랙 슬리퍼 23523001,"역시 닥터마틴은 그냥 디자인을 놓치기가 힘드네요
예뻐요"
마일즈 블랙 슬리퍼 23523001,"평소 240-245신어서 클까봐 걱정했는데
발등 발볼 넓어서 250 샀음
딱좋아요"
마일즈 블랙 슬리퍼 23523001,이거 무난무난하게 아무데나 다 잘어울려서 막 신기 젛습니당 어디에나 편하게 신을 수 있어요
마일즈 블랙 슬리퍼 23523001,"살짝 무겁긴한데 너무 예뻐요!!!
특히 키높이 너무 좋아요 ㅎ"
마일즈 블랙 슬리퍼 23523001,실착 결과 이뻐요 사길 잘했네요 사이즈는 정사이즈 입니다
마일즈 블랙 슬리퍼 23523001,"사이즈는 235신는데 240은 너무 커서 230으로 샀더니 딱 맞아요. 버클 여유롭게 채웠더니 발등 쓸림도 없고
엄청 편안합니다."
마일즈 블랙 슬리퍼 23523001,발도 생각보다 편안하고 굽도 높도 너무 이뻐요! 두개 구입했어요:)
마일즈 블랙 슬리퍼 23523001,발도 생각보다 편안하고 굽도 높도 너무 이뻐요! 정사이즈 신으니까 사이즈 딱 맞아요:)
마일즈 블랙 슬리퍼 23523001,생각보다 굽이 높네요~ 이쁩니다~ 잘 신을게요! 많이 파세요
마일즈 블랙 슬리퍼 23523001,평소 거의 35신는데 30살지 40살지 엄청 고민했는데 30 딱 좋아요~
마일즈 블랙 슬리퍼 23523001,"처음 사보는 샌들이라 고민 많이했는데
사길 잘한것같아요 굽이 좀 있어서 부담스럽지 않을까했는데 괜춘하네욥"
마일즈 블랙 슬리퍼 23523001,"역시 닥터마틴이네요.디자인,퀄리티다 맘에들고 굽도 높아서 만족합니다."
마일즈 블랙 슬리퍼 23523001,발볼이 넓은 편인데 편하고 좋아요! 생각했던 것보다 가벼워서 좋네용 ( ´͈ ᵕ `͈ )◞♡
마일즈 블랙 슬리퍼 23523001,계속 신어서 좀 길들여야될 것 같아요ㅜㅠ 걷다보니 발이 아프고 발등도 좀 까졌는데 그래두 디자인은 넘 이뻐용~!~!
마일즈 블랙 슬리퍼 23523001,살까말까 고민하다가 샀는데 예뻐서 너무 맘에 들어요!
마일즈 블랙 슬리퍼 23523001,원래 사이즈 285인데 십단위로 나와서 290 샀어요! 딱 맞더라고요. 발볼이 작다는 후기도 있어서 걱정했는데 5크게 사니까 적당하네요 :) 남자친구가 엄청 마음에 들어해요.
마일즈 블랙 슬리퍼 23523001,생각보다 사이즈가 크네요 ㅠㅠ 5단위로도 나왔으면 좋았을 것 같지만 그래두 좋아용
마일즈 블랙 슬리퍼 23523001,생각보다 더 투박해여 240인데 정사이즈로 시켰어요 제일 쪼이는 걸로 하니까 딱 맞네요
마일즈 블랙 슬리퍼 23523001,계속 살까말까 고민하다 샀는데 잘 샀네요 컨버스 250 신어서 이것도 250샀는데 발볼 넓은편인데 250은 또 살짝 널널해요
마일즈 블랙 슬리퍼 23523001,사이즈 정사이즈 시켰는데 발볼 한칸씩 줄이니까 딱 좋았어요!
마일즈 블랙 슬리퍼 23523001,굽 높고 디자인도 이뻐서 좋아요 할인받고 싸게 샀어요
마일즈 블랙 슬리퍼 23523001,"너무 예뻐요 조금 크게샀더니 첨엔 까지긴했지만
이뻐서 괜차나용"
마일즈 블랙 슬리퍼 23523001,투박하기만 하면 어쩌나 걱정했는데 생각보다 귀엽고 예쁩니다.
마일즈 블랙 슬리퍼 23523001,자주 구매하던거예요 역시 또 무신사에서 구매했어요.
마일즈 블랙 슬리퍼 23523001,생각보다 편하고 어디든 잘어울려서 아주 만족합니다~
마일즈 블랙 슬리퍼 23523001,"딱 요 무게 요 디자인
닥마 너모너모 편하고 예뻐욤 :)"
마일즈 블랙 슬리퍼 23523001,무거운 느낌이 있지만 실물이 진짜 이뻐요 스트랩 줄이니까 사이즈 딱 적당해요
마일즈 블랙 슬리퍼 23523001,배송 완전 빨라요..진짜 배송완료 문자받고 너무 빨라서 깜짝 놀랐어요 225-230인데 여유롭게 230 샀어요
마일즈 블랙 슬리퍼 23523001,처음에 신을땐 좀 아파요. 길들이면 괜찮아질거 같아요. 튼튼하고 좋습니다.
마일즈 블랙 슬리퍼 23523001,닥터마틴 진짜 좋아하는데 마일즈 슬리퍼 평소에 신고다니기도 좋고 어떤 옷이든 다 어울려요
마일즈 블랙 슬리퍼 23523001,너무 좋아요 진짜 생각보다 편하고 발볼도 넓어서 좋네요
마일즈 블랙 슬리퍼 23523001,"평소 260-265사이즈 신는데, 260선택하니 딱 편안하고 알맞은 사이즈였습니다. 이쁘네요~."
마일즈 블랙 슬리퍼 23523001,"빠른 배송 감사합니다.
디자인 사이즈 착화감 좋습니다."
마일즈 블랙 슬리퍼 23523001,"신발 너무 예쁘고 정사이즈로 샀는데 딱맞아요.
굽이 높아서 발목 삐끗할 수 있어요 ,,"
마일즈 블랙 슬리퍼 23523001,닥터마틴 신발은 처음인데 역시 예쁘긴 하네요! 스티치나 마감이 좋지 않다는 후기가 있어서 걱정했는데 다행히 깔끔한 상품으로 받았습니다. 그런데 역시 무겁긴 하네요ㅜㅜ 그래도 예쁘니까 안고 갑니다^^
마일즈 블랙 슬리퍼 23523001,"어떤 옷이든 닥터마틴 마일즈 블랙 슬리퍼가 완성을 시키네요
정말 맘에 들어요"
마일즈 블랙 슬리퍼 23523001,무난한 룩에 포인트 주기 딱 좋아용! 키가 조금 커지는 것도 조아요
마일즈 블랙 슬리퍼 23523001,착화감 나쁠 줄 알았는데 편안해요. 그리고 이뻐서 자주 신습니다
마일즈 블랙 슬리퍼 23523001,"좋아요 ㅎ 닥마치고는 가벼워요.
굽고 있어서 키도 커보이고 좋아요"
마일즈 블랙 슬리퍼 23523001,만족합니다 만족합니다 만족합니다 만족합니다
마일즈 블랙 슬리퍼 23523001,택배파업으로 3주만에 받았지만 이뻐서 만족합니다 ㅎㅎ
마일즈 블랙 슬리퍼 23523001,역시 쫌 무겁고 불편한감이 없지않아있지만 직접 신어보면 이쁩니당 굽도 높아서 키 왕커짐 굳
마일즈 블랙 슬리퍼 23523001,"확실히 닥터마틴이라 묵직하고 무겁습니다.
슬리퍼형태라 그나마 괜찮네요
멋져서 신지만 편하진 않아요"
마일즈 블랙 슬리퍼 23523001,신발은 예쁜데 너무 무겁고 딱딱 오래신으면 아픔
마일즈 블랙 슬리퍼 23523001,상품잘받앗습니다 꼼꼼한검수후 빠른배송감사합니다
마일즈 블랙 슬리퍼 23523001,너무 이쁜데 바닥이 빨리 달아요ㅠㅠ 신고 나간지 일주일... 신발 밑이 이미 ^^
마일즈 블랙 슬리퍼 23523001,발볼에 넓은편임에도 신었을때 딱 맞았고 생각 외로 단단하게 밑창이 받쳐주는 게 맘에 들었어요
마일즈 블랙 슬리퍼 23523001,남자친구 선물해줬는데 아직 신발에 질이 안들어서 그런지 발볼?쪽이 불편하다고 하네요 신발은 이ㅃㅓ요
마일즈 블랙 슬리퍼 23523001,어디든 잘어울릴것 같아요 스타일 잇어보이고 좋아요
마일즈 블랙 슬리퍼 23523001,너무 좋네요 닥터마틴은 진짜 못잃습니다 자주애용할게요
