title,reviews
맨즈 허리케인 XLT2 / 1019234-BLK,작년에 사서 신다가 버려서 새로 다시 구매했어요 언제나 편하고 좋습니다
맨즈 허리케인 XLT2 / 1019234-BLK,구입하고나서 할인으뢔서 마음이 참 아프네요 ..크흡
맨즈 허리케인 XLT2 / 1019234-BLK,딱 좋고 너무 좋아요 ㅎㅎ 편하고 올 여름 좋은 가격에 잘 신을거같아여 ㅎㅎㅎ
맨즈 허리케인 XLT2 / 1019234-BLK,테바는 믿고 신는 브랜드라서 넘 만족해용!! 아부지 선물로도 구매햇아용 ㅎㅎ
맨즈 허리케인 XLT2 / 1019234-BLK,신발이쁩니당 고민하다 구매했는데 만족스러워용
마일즈 블랙 슬리퍼 23523001,푹신한대 발등이 진짜 아프네요 무겁고..이쁘긴합니다..
마일즈 블랙 슬리퍼 23523001,다른 닥터마틴에 비해 괜찮기는 한데 오래 걸으면 발 아파요
마일즈 블랙 슬리퍼 23523001,발바닥이랑 발등이 너무 아프지만 너무 이뻐요 참을수 없어요
마일즈 블랙 슬리퍼 23523001,처음 신었을 때는 발에 물집도 잡히고 굉장히^^ 아팠는데 예뻐서 그냥 신발에 발을 맞췄어요
마일즈 블랙 슬리퍼 23523001,예쁩니다~쿠폰으로 저렴하게 샀어요~사이즈는 크게나왔어요~한사이즈작게사는게좋네요~휘뚜루마뚜루 어디든 다 잘어울립니다.
마일즈 블랙 슬리퍼 23523001,생각보다 작아요 넉넉히 투업하는게 나을꺼같애요 처음에 발 많이아픕니다
마일즈 블랙 슬리퍼 23523001,선물 해줬는데 엄청 마음에 들어하네요~ 모든 룩에 잘어울랴 솔직히.. 닥마가 너무 이쁘거든여
마일즈 블랙 슬리퍼 23523001,발이약간아프지만 이뻐서 참을만합니다 여름에 신기 좋아요
마일즈 블랙 슬리퍼 23523001,닥터마틴은 무겁고 딱딱하지만 예뻐서 다 인정된다
마일즈 블랙 슬리퍼 23523001,"예쁘고 좋아요
근데 한사이즈 크게 사는것도 좋을거같아요"
마일즈 블랙 슬리퍼 23523001,"여름에 마일즈는 못참지요
발등을 내어주면 길들이는 중입니다"
마일즈 블랙 슬리퍼 23523001,첼시부츠도 220으로 시켜서 잘 맞았는데 마일즈는 슬리퍼라 230시킬까 220시킬까 고민하다 220시켰는데 너무너무 잘맞아요 ㅎㅎ 다들 한사이즈 다운해도 될거같아용
마일즈 블랙 슬리퍼 23523001,"달릴 때 엄청 힘들어 하는 것 같더라구요,,, 신발이 꽤 무거워 보입니당"
마일즈 블랙 슬리퍼 23523001,키높이 효과도 좋고 신발도 너무 이뻐서 여기저기 쉽게 매치해서 신을수 있어요!
마일즈 블랙 슬리퍼 23523001,이쁘고 굽 높고 좋아요 다만 사이즈는 여유있게 한사이즈 업하는게 좋을 거 같아요
마일즈 블랙 슬리퍼 23523001,고민 많이 했는데 사길 잘했어요! 굽이 높은데 편안해요
마일즈 블랙 슬리퍼 23523001,악명 높은 닥터마틴이라 긴장했지만 생각이상으로 편하고 예뻐용
마일즈 블랙 슬리퍼 23523001,"정사이즈고 발등이 좀 까칠해서 길들여야겠지만

나머지는 모두 만족입니다."
마일즈 블랙 슬리퍼 23523001,너무이뻐요! 굽도 높아서 좋아요~ 근데 좀 무겁고 딱딱해요
마일즈 블랙 슬리퍼 23523001,한 사이즈 작게 사는 거 추천합니다ㅠㅠ정사이즈 샀더니 너무 큼..
마일즈 블랙 슬리퍼 23523001,"닥마 워커부터 샌들까지 종류별로 여럿인데
전부 한사이즈 작게 230 딱 맞춰 신었는데
슬리퍼는 정사이즈해야 예쁘고 양말까지 조합할 수 있을 것 같아요! 확실히 굽때몬에 무거워요"
마일즈 블랙 슬리퍼 23523001,처음엔 좀 딱딱한데 신다보면 늘어나서 편해집니다 이뻐요
마일즈 블랙 슬리퍼 23523001,닥터마틴 원래도 불편한거 알았지만 불편함 감수할만큼 예쁩니다..
마일즈 블랙 슬리퍼 23523001,생각보다 푹신하고 편해요 넘 예쁩니당 발볼 늘어나요
마일즈 블랙 슬리퍼 23523001,발 볼 넓고 발등 높은편인데 한칸 늘려신으니까 딱이에요
마일즈 블랙 슬리퍼 23523001,재구매에요 비오는날 절대 신지마세요 안그러면 저처럼 재구매해야됨
마일즈 블랙 슬리퍼 23523001,"외출할때는 안신어봤지만
튼튼할거같고 오래신을수있을거같아요

샌들을 거의 20년만에 사보네요"
마일즈 블랙 슬리퍼 23523001,배송 엄청 빠른니다 ~ 신발 너무 예뻐요~ 아무 옷에 다 잘 어울려요~
마일즈 블랙 슬리퍼 23523001,할인 받아서 싸게 구매했어요 평소 235~240 착용하는데 적당하니 좋아요
마일즈 블랙 슬리퍼 23523001,생각보다 작긴한데 스트랩 풀면 괜찮아요! 디자인 예뻐요 굿
마일즈 블랙 슬리퍼 23523001,생각보다는 푹신하네요 이번여름 마일즈랑 한께 잘 바텨보겠습니댜
마일즈 블랙 슬리퍼 23523001,여자친구가 키가 커서 굽이 높은걸 찾고있었는데 잘 됐어요. 디자인도 이쁘고..대신 오래신지는 못하겠습니다
마일즈 블랙 슬리퍼 23523001,"평소 270-75 신는데
사이즈 너무 잘 맞고 예뻐요
여기저기 잘 어울려요"
마일즈 블랙 슬리퍼 23523001,"닥터마틴은 항상 사이즈보다 한치수 크게 사야할거
같아요 발볼이 좀 있는편이라 신다보면
늘어나겠죠..하하그래도 너무 예쁩니다!!"
마일즈 블랙 슬리퍼 23523001,편하게 신으려고 샀어요 굽이 좀 있는편이라 아주편하진않지만 이쁘고 신을만해용
마일즈 블랙 슬리퍼 23523001,예뻐요 굽이 높아서 걸을때 발목안꺽이게 조심해야함
마일즈 블랙 슬리퍼 23523001,"무겁긴한데 막상신으면 괜찮습니다.
바닥은 푹신한편이지만 오래신으면 뭔가
발목이 아픈 것 같기도 닥터마틴은
신을때마다 길들이기전에 물집잡히곤 하는데
역시나 엄지 발쪽이 물집잡혔어요!
그래도 잘 신을 듯 합니다
양말에 신으면 예쁠듯해용"
마일즈 블랙 슬리퍼 23523001,약간 무겁지만 이뻐요 마음에듭니다 더워서 신기 좋아요
마일즈 블랙 슬리퍼 23523001,무거운데 옙버요.. 양말 맨발 둘 아 너무 예뻐서 무거운가 다 잊을 지경
마일즈 블랙 슬리퍼 23523001,키높이가 좋고 착용감도 좋아서 오래 신어도 안아파요
마일즈 블랙 슬리퍼 23523001,발볼넓은 240한테도 여유잇는 발볼이에요 그래도 슬리퍼라 다른 디자인보단 가벼운편이에여
마일즈 블랙 슬리퍼 23523001,처음에는 딱딱해서 상처나거 그랬는데 넘 예뻐서 넘어감 ㅜ
마일즈 블랙 슬리퍼 23523001,다음날 바로와서 좋고 발편할거같고 키높이 짱이에요
마일즈 블랙 슬리퍼 23523001,예뻐요오 처음에는 좀 아픈데 적응되면 편합니다!
마일즈 블랙 슬리퍼 23523001,넘 이뻐서 가격땜에 고민하다가 쿠폰 받고 질렀어요! 역시 실물이 훨 낫네요ㅎㅎ 근데 좀 많이 신어봐야 적응될 듯
마일즈 블랙 슬리퍼 23523001,적응하는데 시간이 조금 걸리긴 하지만 스타일리시합니다 어디에도 잘 어울려요
마일즈 블랙 슬리퍼 23523001,첫 마틴인데 사이즈 잘 맞았고 생각보다 바닥도 쿠션감이 있어서 편하더라고요!
마일즈 블랙 슬리퍼 23523001,"발 작아보임
워낙 신발이 좀 크고 두꺼운 편이라
그래도 존예 후회 안 함"
마일즈 블랙 슬리퍼 23523001,"발볼은 작은편이고 크게 나온건 240 여유있게는 245 신는데 너무 딱맞을까봐 걱정했는데 아주 조금 여유있게 잘 맞습니다 ㅎㅎ
무겁다고 했는데 진짜 쫌 무겁고, 신었을 때 예쁘긴 한데 굽이 은근 높고 통굽 느낌이라 슬리퍼 느낌보다는 샌들 느낌나네용
착화감은 나쁘지 않은데 발 아픈지는 신고 돌아다녀봐야 알 것 같아요"
마일즈 블랙 슬리퍼 23523001,양말에 신어도 맨발에 신어도 예쁘네요 만족합니다
마일즈 블랙 슬리퍼 23523001,이쁩니다 여름에 코디하기도 좋구 다만 닥마인지라 무거워요
마일즈 블랙 슬리퍼 23523001,배송도 빠르고 발도편하고 굽이있어 키도 커보여요
마일즈 블랙 슬리퍼 23523001,"조금 무겁긴한데 생각보다 발이 아프거나
하진 않아요
반스 220 신는데 이것도 220 신으니까
딱 맞아요"
마일즈 블랙 슬리퍼 23523001,"밴딩부분 발 눌려서 아플까봐 걱정했는데 나쁘지않아요
제이든잇어서 그만큼 무거울려나하고 걱정했는데 그만큼 무겁진않아요 다행 정사이즈 가면 될듯한닏다"
마일즈 블랙 슬리퍼 23523001,"닥터마틴 슬리퍼는 다른 샌들, 워커랑 다르게 정사이즈로 사면 된다고 해서 230으로 샀어요
평소에 운동화 225-230 구두도 225-230 신는 발볼 약간 조금 있는 발인데 편히 맞아요"
마일즈 블랙 슬리퍼 23523001,좀 많이 딱딱하긴 한데 검은 양말 신고 신으면 괜찮아요
마일즈 블랙 슬리퍼 23523001,"가격대비 퀄리티가 좋은지는 모르겠음
다들 크다길래 사이즈 다운했는데 딱맞아서 편하게 신으려고 정사이즈로 교환했습니다. 발볼 넓은 사람은 정사이즈가 편합니다."
마일즈 블랙 슬리퍼 23523001,닥마 무난하게 신고 다닐수 있어요 휘뚜루 마뚜루
마일즈 블랙 슬리퍼 23523001,운동화 정사이즈 225신는데 사이즈 딱좋음 쫌 무거움 근데 이쁨 막 신기 좋을것같음
마일즈 블랙 슬리퍼 23523001,발이 조금 커보이긴 하지만 예뻐요! 평소에 245-50신는데 250신으니까 딱 예쁘게 맞아요
마일즈 블랙 슬리퍼 23523001,정사이즈로 샀는데 너무 딱맞아서 한치수 높게살걸 그랬어요 그래도 만족합니다
마일즈 블랙 슬리퍼 23523001,디자인도이쁘고가격대비만족하는상품입니다
마일즈 블랙 슬리퍼 23523001,짘짜 예뻐요 조금 무겁긴 한데 키높이도 좋고 다 좋아요
마일즈 블랙 슬리퍼 23523001,원래 신었던건데 닳아서 또 샀어요 제일 편합니다
마일즈 블랙 슬리퍼 23523001,"아프고 무겁다는 평가가 더러 있어서 걱정이 되었는데
발 앞으로 해서 꼭 맞게 신고 얌전히? 걸으면 안아파요 ㅎㅎ
그리고 너무 귀엽고 고급지네요~
발 240에 볼이 조금 있는 편인데
볼도 넉넉하고 길이도 아주조금 남는 편이에요~
너무 만족합니다~"
마일즈 블랙 슬리퍼 23523001,무거울까봐 걱정했는데 무겁지않네요 ! 딱 좋아요 발볼 조절도 되고
마일즈 블랙 슬리퍼 23523001,버클형태라 자신의 발에 맞게 조절할수있어서 좋아요 다만 신다보면 발등에 상처가나요 긁혀서 그런거같은데 초반에는 밴드 붙이고 신어여댈거같아요 시간지나면 괜찮아져요
마일즈 블랙 슬리퍼 23523001,첨에는 너무 딱딱해서 발이 좀 까졌는데 지금은 잘 신고 다녀요 확실히 예쁩니다
마일즈 블랙 슬리퍼 23523001,살 때 불편하면 어떡하나 걱정했는데 생각보다 너무너무 편해요 올 여름에 이것만 신고 다닐 듯..
마일즈 블랙 슬리퍼 23523001,실물이 훨씬 예뻐요 구매하기를 잘 한 것 같아요 여름에 자주 신을 것 같습니다
마일즈 블랙 슬리퍼 23523001,역시 닥터마틴이네요.. 말할것도 없고 좋아용 생각보다 굽이높았어요 넘 이쁘네여 ㅠ <...
마일즈 블랙 슬리퍼 23523001,"발볼 넓은 235인데 230 사이즈 신으니까 처음 셋팅된 버클로는 살짝 작은 느낌이고 버클 한칸씩 늘이니까 넉넉해요~ 발 길이는 딱! 맞습니당. 혹시나 길이까지 넉넉하게 신고싶은 발볼넓은 235라면 240으로 사는게
맞을 것 같지만 사이즈 커질때마다 신발 무게가 많이 무거워질 것 같아서 저는 230 만족해요~
디자인은 정말 예뻐요👍"
마일즈 블랙 슬리퍼 23523001,잘 이용하고 있습니다 재구매 의사 있습니다 감사합니다
마일즈 블랙 슬리퍼 23523001,"무겁다고 했지만 많이 무겁지 않을 거라고 생각했는데 무겁네요 발등도 아직 맨발로는 좀 아파요
무게 때문에 발등에 무게 실려서 더 그런 것 같아요 사이즈는 발볼 있고 반스 225, 컨버스 230신어요 220 끈 늘리면 이쁘게 신을 수 있어요"
마일즈 블랙 슬리퍼 23523001,마음에 들어요 투박한듯 세련된 느낌이 있어요 잘 신고 다니는 중입니다
마일즈 블랙 슬리퍼 23523001,생각보다 발볼도 좁고 사이즈가 10단위로 나온 게 좀 아쉽긴 하지만 너무너무 예뻐서 자꾸 손이 가네요
마일즈 블랙 슬리퍼 23523001,배송 완전빠르고 만족합니다! 포장도 꼼꼼하고 스티커도 나름 귀엽!
마일즈 블랙 슬리퍼 23523001,운동화 60 정도 신는데 업 했음. 적당히 편하고 여유있게 잘 맞음.
마일즈 블랙 슬리퍼 23523001,"좋아요
배송도 빠르고 맘에 들어요 잘 신을게요
감사합니다"
마일즈 블랙 슬리퍼 23523001,아주 예쁘네요 배송도 빨라서 아주 마음에 듭니다
마일즈 블랙 슬리퍼 23523001,"기대했단만큼 마음에 드네요
투박해보이지만 닥터마틴의 매력이죠"
마일즈 블랙 슬리퍼 23523001,"남자친구 선물로 주려고 샀어요~ 닥터마틴스러운 디자인, 예쁘네요~!!"
마일즈 블랙 슬리퍼 23523001,닥마라 딱딱할까봐 걱정했는데 생각보다 말랑하고 편해요 키높이 돼서 좋습니다아
마일즈 블랙 슬리퍼 23523001,매년 다시 사요 맨발로 신으면 나중엔 발냄새가 나지만 이뻐서 사엽
마일즈 블랙 슬리퍼 23523001,딱딱한 바닥이나 너무 이뻐서 자주 애용하는 템입니당
마일즈 블랙 슬리퍼 23523001,처음에는 신발이 무거워서 발이 아플 수 있으니 유의하세요
마일즈 블랙 슬리퍼 23523001,컨버스 250 딱 맞게 신고 발볼 좁은데 250 하니까 앞뒤로 발이 튀어나와서 260으로 교환했습니당 걸어다니면 발바닥이 좀 아프긴해요!
마일즈 블랙 슬리퍼 23523001,좋아요.. 좋습니다 여름에 잘 신도록 하겠습니자아
마일즈 블랙 슬리퍼 23523001,"일단 무거워서 오래걷기에 불편,
내가 받은 제품만 그런건진 모르겠지만,
발볼이 양 옆이 안 맞음 .."
마일즈 블랙 슬리퍼 23523001,"너무 이쁘고 데일리로 신기 딱이에요
익숙해지니 편해용"
마일즈 블랙 슬리퍼 23523001,발이 아프긴 한데 한두번 정도 신으면 괜찮아집니다
마일즈 블랙 슬리퍼 23523001,255 신는데 260사니 딱맞네요 저는 생각보다 편하고 굽이있러 좋았습니다
마일즈 블랙 슬리퍼 23523001,"가죽 튼튼하고 스티치 정말이쁘네요
편안합니다"
마일즈 블랙 슬리퍼 23523001,키작아서 못입던 청바지도 거뜬히 입을 수 있게 만들어주는 키높이 닥마 샌들 ~~ ♡
마일즈 블랙 슬리퍼 23523001,"조금 무겁긴 한데,,
신발 예뻐서 좋아요
이제부터 잘 신고다닐 거 같아요 !
남친이랑 같이 신은 사진 후기 올리러 오겠습니다~"
마일즈 블랙 슬리퍼 23523001,"딱 맞아서 두번째 부분을 조금 늘려신고있습니다
커플끼리 신기에 좋은 신발 같네요 ㅎㅎ
잘 신을게요"
마일즈 블랙 슬리퍼 23523001,발모양에 맞게 되어있어 편하고 푹신해요 배송도 엄청 빨랐어요
마일즈 블랙 슬리퍼 23523001,"소문으로 무겁다는거 알고 있었지만 생각보다 조금 더 무거웠구요 살짝 컷어요~ 5단위로 나오면 참 좋을텐데ㅠㅠ
신발은 기대이상으로 너무 이뻐요!!!"
마일즈 블랙 슬리퍼 23523001,무겁고조금딱탁앞이너무길어서보기싫음2점
마일즈 블랙 슬리퍼 23523001,다른 모델보다 더 편하고 어디에나 신기 좋아요 오래오래 잘 신을것같습니다~
마일즈 블랙 슬리퍼 23523001,"군더더기없이 갈끔하고 키높이가 참 맘에 든다.
선물용으로 성공"
마일즈 블랙 슬리퍼 23523001,남자가 신기에는 글쎄요 쉐입은 여자용 인듯해요
마일즈 블랙 슬리퍼 23523001,사이즈 반다운에서 하나다운해도 ㄱㅊ 워커나 샌들보다 바닥이 말랑해서 편함
마일즈 블랙 슬리퍼 23523001,넘 좋습니다 역시 닥터마틴 ㅜㅜ ㅔ발 아프지만 적응대면 편하게 신을 거 같아요 사이즈도 정사이즈 딱 조아요
마일즈 블랙 슬리퍼 23523001,"컨버스 240,반스 240 신는데 마일즈도 240이 딱 좋아요! 발등 높은 편입니당"
마일즈 블랙 슬리퍼 23523001,이쁘네요 아주 겁나게 이쁘네요 맘에 듭니다 하하ㅏ하
마일즈 블랙 슬리퍼 23523001,"잘받았습니다. 좋은상품보내주셔서 감사합니다.
후회없는 선택이었어여"
마일즈 블랙 슬리퍼 23523001,220신는데 마일즈는 좀 크게신는ㄱㅔ 이쁜거같아서 230으로 골랐는데 딱이에요! 의외로 편해서 잘신구있어영
마일즈 블랙 슬리퍼 23523001,"245사이즈고 240, 250 둘다 신어봤는데
240은 여유없이 딱맞고 250은 앞이 많이 남았어요
두 사이즈 다 나쁘지 않은데 전 사이즈업하긴 싫어서
스트랩 한칸 늘리고 240으로 신을려구요
왜 5단위로 안나오는건가요ㅠ"
마일즈 블랙 슬리퍼 23523001,좀 무겁고 발등아파서 오래 못신어요 신다보면 괜찮을듯
마일즈 블랙 슬리퍼 23523001,닥터마틴이라서 불편할줄?알았는디 생각보다 편안해서 자주신어요
마일즈 블랙 슬리퍼 23523001,발볼이 넓어서 사이즈 반업해서 샀어요 그러니깐 딱 맞네요
마일즈 블랙 슬리퍼 23523001,정말 너무 예쁘지만 .. 제가 발이 얇고 긴 편인데..양말 없이 신으면 발이 까지고 걸을때마다 발등이 너무 아파요…예뻐서 참고 신는데 장거리엔 절대 못 신고 갈 것 같아요.
마일즈 블랙 슬리퍼 23523001,편한슬리퍼는 아니고 스타일내는 슬리용이에요
마일즈 블랙 슬리퍼 23523001,조금 딱 맞지만 버클을 넓혀서 신고 있습니다 예뻐요
마일즈 블랙 슬리퍼 23523001,일단 핏이 너무 이쁘고 착화감이 좋습니다 구두보다는 훨씬 편안해요
마일즈 블랙 슬리퍼 23523001,무겁지만 예뻐요 발볼이 있어서 한단계 느슨하게 했더니 넉넉해서 좋습니다
마일즈 블랙 슬리퍼 23523001,"예쁘기도 하고 불편하기도 하고 무겁기도 하고..
근데 디자인이 이쁘구 키커져서 아주 잘 신고 다녀요
바닥이 잘 닳는것 같기도 해용"
마일즈 블랙 슬리퍼 23523001,"여름에 좋은데 딱딱해요
걸을때 무거워서 아마도 조금 불편할수있습니다"
마일즈 블랙 슬리퍼 23523001,빨리 배송와서 좋았는데 사이즈가 커서 교환했어요 이쁘긴 합니다
마일즈 블랙 슬리퍼 23523001,"사이즈 계속 고민하다가 그냥 정사이즈 샀어요
버클 하나씩 옮겨서 신으니까 딱 좋아요
아직 안걸어봐서 불편한진 모르겠는데
너무 예쁨"
마일즈 블랙 슬리퍼 23523001,"맘에 듭니다. 맨발에는 처음이라 오래 걸으면 좀 아프지만, 양말 신고 신으면 편합니다."
마일즈 블랙 슬리퍼 23523001,기성 사이즈 대비 작게 나왔습니다. 5사이즈 더 여유롭게 주문하시면 딱 좋아보입니다.
마일즈 블랙 슬리퍼 23523001,키높이도 되고 매우 편해요!다음에도 또 살거같아요
마일즈 블랙 슬리퍼 23523001,굽 높이도 좋고 디자인도 이쁘고 여름내내 신고다닐예정
마일즈 블랙 슬리퍼 23523001,키작은남친에게선물ㅋ.ㅋ 이뻐요 샌들중에는 닥터마틴이젤편한듯ㅜㅜ
마일즈 블랙 슬리퍼 23523001,편하게 여름부터 가을까지 신을수있을것같아요
마일즈 블랙 슬리퍼 23523001,선물 주려고 구매했는데 디자인도 예쁘고 마음에 들어해서 좋네요
마일즈 블랙 슬리퍼 23523001,시착만 해봤는데 무겁긴한데 튼튼하고 패셔너블해보여서 좋네요~
마일즈 블랙 슬리퍼 23523001,작년부터 고민끝에 이제서야 샀는데 진작살걸 그랬어요
마일즈 블랙 슬리퍼 23523001,닥터마틴치곤 착화감은 괜찮아요 발볼이 좀 넓은 편이라 밑에 줄만 한칸 늘렸더니 딱이에요 위에 줄도 늘렸다가 넘 헐렁하니까 발볼쪽이 다 쓸리더라구요 위에는 3칸 하니까 딱 잡아줘서 좋은 거 같아요
마일즈 블랙 슬리퍼 23523001,닥마특유의 느낌들이 있어요! 자꾸신을수록 편햐집니당
마일즈 블랙 슬리퍼 23523001,닥마 처음이라 걱정했는데 너무 좋네요 ㅋㅋ 샌들도 하나 더 사고 싶어요
마일즈 블랙 슬리퍼 23523001,하루종일 신었다가 발등 박살났어유ㅠㅠ 진짜 겁나 아프고 불편한데 또 이쁘긴해요..적응할때까지 힘내라 내발아
마일즈 블랙 슬리퍼 23523001,"다른사람 신은거보고 이뻐서샀어오
키커져서 좋아요"
마일즈 블랙 슬리퍼 23523001,생각보다 푹신하고 안아파서 좋았어요 슬리퍼라 뒤에가 뚫려있어서 편해요
마일즈 블랙 슬리퍼 23523001,이쁘고 좋아요. 어느정도 굽이 있어서 키높이에도 적당해요
마일즈 블랙 슬리퍼 23523001,너무좋아서잘신고다닐것같아요 좋습니다좋아요
마일즈 블랙 슬리퍼 23523001,쿠폰적용해서 저렴하게 잘산거같아요 올여름 잘신고 다닐게요~
마일즈 블랙 슬리퍼 23523001,"운동화 240 구두 250로 사이즈 진짜 고민 많이 했는데
늘어난다고 해서 240으로 구매 했습니다
제가 발볼이 많이 큰편이라서 버클부분 한단계씩 늘리니까 딱 맞네요
맘에들어용
근데 제거만 그런건지 몰라도 이음새 부분이 좀 튀게 빗나가져 있네요"
마일즈 블랙 슬리퍼 23523001,"굽도 있고 여름에 신기 좋을거같다고 아주 좋아하네요. 역시 좀 무겁고 딱딱하긴 하답니다. 그래도 예쁘잖아요. 뭐 닥터마틴이 그런거 아니겠읍니까?
다만 매장에서 입어볼때랑 사이즈표가 달라서 인터넷에 찾아보셔야 할거같습니다. 매장은 uk사이즈였던거 같습니다. 정확한지는 모르겠으니 꼭 찾아보세요~"
마일즈 블랙 슬리퍼 23523001,이뻐요ㅜㅜ여름샌들로딱이에용 쿠폰으로싸게잘삿어용
마일즈 블랙 슬리퍼 23523001,전부터 갖고싶던 슬리퍼인데 신어보니 쿠션이 있어서 착용감 편안하고 굽 적당해서 좋습니다 ㅎㅎ 다만 가죽 제품이어서 그런지 맨발에 신으면 발등이 조금 쓸려서 아파요 ㅠ
마일즈 블랙 슬리퍼 23523001,와 진짜 무겁긴 하네요 슬리퍼가 그나마 편할 것 같아서 삿는데 개무거워요ㅠㅠㅜ 사이즈는 245 기준으로 딱 맞아요 여유는 없구
마일즈 블랙 슬리퍼 23523001,"발볼러라 1사이즈업 했는데 잘 맞습니다
두 줄 다 버클이라 편하구요"
마일즈 블랙 슬리퍼 23523001,착화감도 편안하고 볼 조절도 할 수 있어서 길이에 맞추면 됩니다
마일즈 블랙 슬리퍼 23523001,할인받아서 샀는데 너무 기분좋고 평소 발280이나 285신는분은 290으로 가는게 신기 편합니다.
마일즈 블랙 슬리퍼 23523001,발등에 털이 있는데 은근 도드라보여집니다 조심하세요 ㄷ ㄷ
마일즈 블랙 슬리퍼 23523001,발등 부분이 딱딱해서 발등에 자국나고 착색됐어요ㅠㅠ
마일즈 블랙 슬리퍼 23523001,발등 부분이 점 딱딱해서 길들이는 시간이 약간 필요해요
마일즈 블랙 슬리퍼 23523001,235-240신고 발등이 높은데 발등은 조절 가능하니까 230사도 잘 맞고 예쁘게 신을 수 있어요
마일즈 블랙 슬리퍼 23523001,신다보니 발가락이 자꾸 쓸리는 등 자잘하게 불편한 슬리퍼지만 예쁘긴 엄청 예뻐요
마일즈 블랙 슬리퍼 23523001,다른 닥터마틴 신발들을 250 신어서 동일 사이즈로 갔습니다 딱 맞네요
마일즈 블랙 슬리퍼 23523001,"좋은가격에 좋은제품 잘 받았습니다
가격대는 좀 있지만 좋네요"
마일즈 블랙 슬리퍼 23523001,"조아여 여친이랑 커플로 했는데 만족해합니다
다만 발아픈건 어쩔수없는듯"
마일즈 블랙 슬리퍼 23523001,"좋아요
다만
스티치가 좀 누래요
그건 복불복인거 같네요"
마일즈 블랙 슬리퍼 23523001,착화감 생각보다 나쁘지 않고 좋습니다 다만 밑창 내구도가 생각보다 약해요 오래신진 못할것 같아요
마일즈 블랙 슬리퍼 23523001,친구 생일선물로 사줬는데 키높이도 있고 무난하고 예쁜거같아요 ㅎㅎ 무엇보다 심플해서 예쁜거 같아요 잘 구매했습니다
마일즈 블랙 슬리퍼 23523001,언제나 닥터마틴은 딱 닥터마틴입니다. 대신 슈퍼 무거움
마일즈 블랙 슬리퍼 23523001,디자인은 예쁘지만 무겁고 착화감이 편하지 않아요. 감안하고 산부분이라 만족합니다
마일즈 블랙 슬리퍼 23523001,만족합니다 쿠션감이 크진않아요 굽은살짝있는편
마일즈 블랙 슬리퍼 23523001,좋아요. 아주 편하고 좋습니다. 투자할망 합니다 크쿠
마일즈 블랙 슬리퍼 23523001,여자친구 사줬는데 이쁘게 잘 신네요. 여기저기 잘 어울려요.
마일즈 블랙 슬리퍼 23523001,"신랑 사줬는데 거의 매일 신고다니네요
무겁지만 착화감은 좋습니다"
